{
"type": "FeatureCollection",
"name": "Fire_Stations",
"crs": { "type": "name", "properties": { "name": "urn:ogc:def:crs:OGC:1.3:CRS84" } },
"features": [
{ "type": "Feature", "properties": { "OBJECTID": 2645, "PERMANENT_IDENTIFIER": "{F07E224D-D5D6-44DD-B2CA-5ADB414673DD}", "SOURCE_FEATUREID": "10522666", "SOURCE_DATASETID": "a9fde8f0-4665-4fb0-a41e-c142025bd57e", "SOURCE_DATADESC": "740 TNMC Update 10/18/2016 09:22:28", "SOURCE_ORIGINATOR": "U.S. Geological Survey", "DATA_SECURITY": 5, "DISTRIBUTION_POLICY": "E4", "LOADDATE": "2016-10-18T09:25:54Z", "FTYPE": 740, "FCODE": 74026, "NAME": "Los Angeles County Fire Department Station 101", "ISLANDMARK": null, "POINTLOCATIONTYPE": 1, "ADMINTYPE": null, "ADDRESSBUILDINGNAME": null, "ADDRESS": "606 West Bonita Avenue", "CITY": "Claremont", "STATE": "CA", "ZIPCODE": "91711", "GNIS_ID": "2105685", "FOOT_ID": null, "COMPLEX_ID": null, "GLOBALID": "{9209D351-33A2-4234-9E5D-DB6939BA1D24}" }, "geometry": { "type": "Point", "coordinates": [ -117.723579406999988, 34.096202850000054 ] } },
{ "type": "Feature", "properties": { "OBJECTID": 2646, "PERMANENT_IDENTIFIER": "{8211277F-8D3D-4BAE-AF8C-3E6EC787C430}", "SOURCE_FEATUREID": "9999999999", "SOURCE_DATASETID": "a9fde8f0-4665-4fb0-a41e-c142025bd57e", "SOURCE_DATADESC": "740 TNMC Update 10/18/2016 09:22:28", "SOURCE_ORIGINATOR": "U.S. Geological Survey", "DATA_SECURITY": 5, "DISTRIBUTION_POLICY": "E4", "LOADDATE": "2016-10-18T09:46:30Z", "FTYPE": 740, "FCODE": 74026, "NAME": "Los Angeles County Fire Department Station 62", "ISLANDMARK": null, "POINTLOCATIONTYPE": 1, "ADMINTYPE": null, "ADDRESSBUILDINGNAME": null, "ADDRESS": "3710 North Mills Avenue", "CITY": "Claremont", "STATE": "CA", "ZIPCODE": "91711-1440", "GNIS_ID": "2105672", "FOOT_ID": null, "COMPLEX_ID": null, "GLOBALID": "{C0860E81-14B5-40B2-A4D1-AAFC53059A90}" }, "geometry": { "type": "Point", "coordinates": [ -117.707733153999982, 34.136280059000057 ] } },
{ "type": "Feature", "properties": { "OBJECTID": 2649, "PERMANENT_IDENTIFIER": "{6E74FE27-F8B3-4CDB-8609-40356C1E1159}", "SOURCE_FEATUREID": null, "SOURCE_DATASETID": "{CC44F99C-6658-4584-B606-926E498D5C82}", "SOURCE_DATADESC": "TNMC VWE DB Build - Vol Update", "SOURCE_ORIGINATOR": "U.S. Geological Survey", "DATA_SECURITY": 5, "DISTRIBUTION_POLICY": "E4", "LOADDATE": "2016-07-27T00:00:00Z", "FTYPE": 740, "FCODE": 74026, "NAME": "EL Segundo Fire Department Station 2", "ISLANDMARK": null, "POINTLOCATIONTYPE": 1, "ADMINTYPE": null, "ADDRESSBUILDINGNAME": null, "ADDRESS": "2261 Mariposa Avenue", "CITY": "El Segundo", "STATE": "CA", "ZIPCODE": "90245", "GNIS_ID": null, "FOOT_ID": null, "COMPLEX_ID": null, "GLOBALID": "{A356E3A2-6D23-4F1E-920C-658F9AFC0E82}" }, "geometry": { "type": "Point", "coordinates": [ -118.384910599999955, 33.924061734000077 ] } },
{ "type": "Feature", "properties": { "OBJECTID": 2651, "PERMANENT_IDENTIFIER": "{03F027BF-F279-4EEE-8BAE-73767C55D895}", "SOURCE_FEATUREID": null, "SOURCE_DATASETID": "{CC44F99C-6658-4584-B606-926E498D5C82}", "SOURCE_DATADESC": "TNMC VWE DB Build - Vol Update", "SOURCE_ORIGINATOR": "U.S. Geological Survey", "DATA_SECURITY": 5, "DISTRIBUTION_POLICY": "E4", "LOADDATE": "2015-09-08T14:36:40Z", "FTYPE": 740, "FCODE": 74026, "NAME": "California Department of Forestry and Fire Protection NEU Station 40", "ISLANDMARK": 2, "POINTLOCATIONTYPE": 4, "ADMINTYPE": null, "ADDRESSBUILDINGNAME": null, "ADDRESS": "8839 Highway 20", "CITY": "Smartsville", "STATE": "CA", "ZIPCODE": "95977", "GNIS_ID": null, "FOOT_ID": null, "COMPLEX_ID": null, "GLOBALID": "{11AE10FD-ECE8-49AA-A3EE-F26C01059D5D}" }, "geometry": { "type": "Point", "coordinates": [ -121.289160596999977, 39.202265048000072 ] } },
{ "type": "Feature", "properties": { "OBJECTID": 2687, "PERMANENT_IDENTIFIER": "{E6AB51D2-311B-4005-9112-04B59E133890}", "SOURCE_FEATUREID": "9999999999", "SOURCE_DATASETID": "{CC44F99C-6658-4584-B606-926E498D5C82}", "SOURCE_DATADESC": "TNMC VWE DB Build - Vol Update", "SOURCE_ORIGINATOR": "U.S. Geological Survey", "DATA_SECURITY": 5, "DISTRIBUTION_POLICY": "E4", "LOADDATE": "2016-08-12T12:31:48Z", "FTYPE": 740, "FCODE": 74026, "NAME": "El Cerrito Fire Department Station 72", "ISLANDMARK": 2, "POINTLOCATIONTYPE": 1, "ADMINTYPE": null, "ADDRESSBUILDINGNAME": null, "ADDRESS": "1520 Arlington Boulevard", "CITY": "El Cerrito", "STATE": "CA", "ZIPCODE": "94530-2003", "GNIS_ID": null, "FOOT_ID": null, "COMPLEX_ID": null, "GLOBALID": "{027167F7-8E9A-46F9-B6D0-3FE6151CB152}" }, "geometry": { "type": "Point", "coordinates": [ -122.299749714999962, 37.92983866600008 ] } },
{ "type": "Feature", "properties": { "OBJECTID": 2688, "PERMANENT_IDENTIFIER": "{76BAB48B-5AFC-4C51-9F93-16F47494D70F}", "SOURCE_FEATUREID": null, "SOURCE_DATASETID": "{CC44F99C-6658-4584-B606-926E498D5C82}", "SOURCE_DATADESC": "TNMC VWE DB Build - Vol Update", "SOURCE_ORIGINATOR": "U.S. Geological Survey", "DATA_SECURITY": 5, "DISTRIBUTION_POLICY": "E4", "LOADDATE": "2016-07-27T00:00:00Z", "FTYPE": 740, "FCODE": 74026, "NAME": "Gull Lake Fire Station - Forest Service", "ISLANDMARK": null, "POINTLOCATIONTYPE": 1, "ADMINTYPE": null, "ADDRESSBUILDINGNAME": null, "ADDRESS": "3819 California 158", "CITY": "June Lake", "STATE": "CA", "ZIPCODE": "93529", "GNIS_ID": null, "FOOT_ID": null, "COMPLEX_ID": null, "GLOBALID": "{90A32F99-9B89-471C-A0B8-7D304F38902C}" }, "geometry": { "type": "Point", "coordinates": [ -119.084403088999977, 37.772429285000044 ] } },
{ "type": "Feature", "properties": { "OBJECTID": 3257, "PERMANENT_IDENTIFIER": "{888ACA39-FEDD-480E-BC7B-DACEC5E5115F}", "SOURCE_FEATUREID": "10508259", "SOURCE_DATASETID": "a67e37d3-ede5-4ae1-a9ab-3f76094db6ae", "SOURCE_DATADESC": "730 TNMC Update 09/21/2016 15:05:47", "SOURCE_ORIGINATOR": "Oak Ridge National Laboratory, Geographic Information Sciences and Technology Group", "DATA_SECURITY": 5, "DISTRIBUTION_POLICY": "E4", "LOADDATE": "2016-09-21T16:53:19Z", "FTYPE": 740, "FCODE": 74026, "NAME": "Department of Forestry and Fire Protection Station 18 Cordilleras Fire Station", "ISLANDMARK": 2, "POINTLOCATIONTYPE": 1, "ADMINTYPE": null, "ADDRESSBUILDINGNAME": null, "ADDRESS": "300 Edmonds Road", "CITY": "Redwood City", "STATE": "CA", "ZIPCODE": "94062", "GNIS_ID": "2624230", "FOOT_ID": null, "COMPLEX_ID": null, "GLOBALID": "{E5A4692E-89B0-4FA0-A34A-9BA33634948F}" }, "geometry": { "type": "Point", "coordinates": [ -122.286018371999944, 37.473049163000042 ] } },
{ "type": "Feature", "properties": { "OBJECTID": 3258, "PERMANENT_IDENTIFIER": "{AFDFF2AC-4801-492A-929A-5FE7DEDC61CC}", "SOURCE_FEATUREID": "10511708", "SOURCE_DATASETID": "a67e37d3-ede5-4ae1-a9ab-3f76094db6ae", "SOURCE_DATADESC": "730 TNMC Update 09/21/2016 15:05:47", "SOURCE_ORIGINATOR": "Oak Ridge National Laboratory, Geographic Information Sciences and Technology Group", "DATA_SECURITY": 5, "DISTRIBUTION_POLICY": "E4", "LOADDATE": "2016-09-21T16:43:16Z", "FTYPE": 740, "FCODE": 74026, "NAME": "Redwood City Fire Department Station 12", "ISLANDMARK": 2, "POINTLOCATIONTYPE": 1, "ADMINTYPE": null, "ADDRESSBUILDINGNAME": null, "ADDRESS": "3700 Jefferson Avenue", "CITY": "Redwood City", "STATE": "CA", "ZIPCODE": "94062", "GNIS_ID": "2107887", "FOOT_ID": null, "COMPLEX_ID": null, "GLOBALID": "{F86023EA-D53B-4F5A-96AD-74E4626F18CE}" }, "geometry": { "type": "Point", "coordinates": [ -122.254104613999971, 37.465301514000032 ] } },
{ "type": "Feature", "properties": { "OBJECTID": 3274, "PERMANENT_IDENTIFIER": "{8D397EFD-9FB3-401C-B8F1-167133B018A0}", "SOURCE_FEATUREID": "10521421", "SOURCE_DATASETID": "a67e37d3-ede5-4ae1-a9ab-3f76094db6ae", "SOURCE_DATADESC": "730 TNMC Update 09/21/2016 15:05:47", "SOURCE_ORIGINATOR": "Oak Ridge National Laboratory, Geographic Information Sciences and Technology Group", "DATA_SECURITY": 5, "DISTRIBUTION_POLICY": "E4", "LOADDATE": "2016-09-21T16:57:37Z", "FTYPE": 740, "FCODE": 74026, "NAME": "Woodside Fire Protection District Station 19", "ISLANDMARK": 2, "POINTLOCATIONTYPE": 4, "ADMINTYPE": null, "ADDRESSBUILDINGNAME": null, "ADDRESS": "4091 Jefferson Avenue", "CITY": "Redwood City", "STATE": "CA", "ZIPCODE": "94062", "GNIS_ID": "2623899", "FOOT_ID": null, "COMPLEX_ID": null, "GLOBALID": "{B4C28B3F-8450-4F48-8A80-5A05F02AC7A4}" }, "geometry": { "type": "Point", "coordinates": [ -122.267127989999949, 37.45735931400003 ] } },
{ "type": "Feature", "properties": { "OBJECTID": 3275, "PERMANENT_IDENTIFIER": "{566CA87C-8A68-43C6-A750-78851CEDB02F}", "SOURCE_FEATUREID": "10511705", "SOURCE_DATASETID": "34446b40-b867-485c-b56d-51c1998e8bb7", "SOURCE_DATADESC": "740 TNMC Update 09/21/2016 16:40:17", "SOURCE_ORIGINATOR": "U.S. Geological Survey", "DATA_SECURITY": 5, "DISTRIBUTION_POLICY": "E4", "LOADDATE": "2016-09-21T16:40:16Z", "FTYPE": 740, "FCODE": 74026, "NAME": "Redwood City Fire Department Station 10", "ISLANDMARK": 2, "POINTLOCATIONTYPE": 1, "ADMINTYPE": null, "ADDRESSBUILDINGNAME": null, "ADDRESS": "2190 Jefferson Avenue", "CITY": "Redwood City", "STATE": "CA", "ZIPCODE": "94061", "GNIS_ID": "2107889", "FOOT_ID": null, "COMPLEX_ID": null, "GLOBALID": "{8EB1824C-3C55-4AF5-BD70-4CCBA0934B96}" }, "geometry": { "type": "Point", "coordinates": [ -122.239402770999959, 37.474918366000054 ] } },
{ "type": "Feature", "properties": { "OBJECTID": 5978, "PERMANENT_IDENTIFIER": "{7112DDE6-BBD3-4D69-8AB0-88D75BCC9DF3}", "SOURCE_FEATUREID": "10523277", "SOURCE_DATASETID": "009946fa-cf15-498c-84c4-07f827f258e4", "SOURCE_DATADESC": "740 TNMC Update 09/17/2016 23:10:36", "SOURCE_ORIGINATOR": "U.S. Geological Survey", "DATA_SECURITY": 5, "DISTRIBUTION_POLICY": "E4", "LOADDATE": "2016-09-17T23:16:13Z", "FTYPE": 740, "FCODE": 74026, "NAME": "Roseville Fire Station 2", "ISLANDMARK": 2, "POINTLOCATIONTYPE": 1, "ADMINTYPE": null, "ADDRESSBUILDINGNAME": null, "ADDRESS": "1398 Junction Boulevard", "CITY": "Roseville", "STATE": "CA", "ZIPCODE": "95747", "GNIS_ID": "2621959", "FOOT_ID": null, "COMPLEX_ID": null, "GLOBALID": "{1BDC0248-2A12-4A11-BB28-E53C19EC8229}" }, "geometry": { "type": "Point", "coordinates": [ -121.313018798999963, 38.759529114000031 ] } },
{ "type": "Feature", "properties": { "OBJECTID": 5979, "PERMANENT_IDENTIFIER": "{24C6398E-A1DE-4164-A728-6979B8240914}", "SOURCE_FEATUREID": "10521043", "SOURCE_DATASETID": "009946fa-cf15-498c-84c4-07f827f258e4", "SOURCE_DATADESC": "740 TNMC Update 09/17/2016 23:10:36", "SOURCE_ORIGINATOR": "U.S. Geological Survey", "DATA_SECURITY": 5, "DISTRIBUTION_POLICY": "E4", "LOADDATE": "2016-09-18T02:23:02Z", "FTYPE": 740, "FCODE": 74026, "NAME": "Sacramento Metropolitan Fire District Station 29", "ISLANDMARK": 2, "POINTLOCATIONTYPE": 1, "ADMINTYPE": null, "ADDRESSBUILDINGNAME": null, "ADDRESS": "8681 Greenback Lane", "CITY": "Orangevale", "STATE": "CA", "ZIPCODE": "95662", "GNIS_ID": "2061495", "FOOT_ID": null, "COMPLEX_ID": null, "GLOBALID": "{A6E4D289-3967-45E8-BCAC-3B0CADB8B592}" }, "geometry": { "type": "Point", "coordinates": [ -121.236976623999965, 38.679046631000062 ] } },
{ "type": "Feature", "properties": { "OBJECTID": 5980, "PERMANENT_IDENTIFIER": "{CE83053D-4BA5-4DDB-8095-B7A2CB21B557}", "SOURCE_FEATUREID": "10507582", "SOURCE_DATASETID": "63bc2991-934b-43e8-a9ff-8848e77cee04", "SOURCE_DATADESC": "740 TNMC Update 09/18/2016 19:35:35", "SOURCE_ORIGINATOR": "U.S. Geological Survey", "DATA_SECURITY": 5, "DISTRIBUTION_POLICY": "E4", "LOADDATE": "2016-09-18T19:35:34Z", "FTYPE": 740, "FCODE": 74026, "NAME": "Amador Fire Protection District Station 122", "ISLANDMARK": 2, "POINTLOCATIONTYPE": 1, "ADMINTYPE": null, "ADDRESSBUILDINGNAME": null, "ADDRESS": "18534 Sherwood Street", "CITY": "Plymouth", "STATE": "CA", "ZIPCODE": "95669", "GNIS_ID": "2624151", "FOOT_ID": null, "COMPLEX_ID": null, "GLOBALID": "{428D0D04-C669-4CE6-8E4B-DDCC3B75E9C6}" }, "geometry": { "type": "Point", "coordinates": [ -120.851158141999974, 38.47859954900008 ] } },
{ "type": "Feature", "properties": { "OBJECTID": 6273, "PERMANENT_IDENTIFIER": "{5383F21F-DE9A-45FB-87B3-CAE2980B2D07}", "SOURCE_FEATUREID": "10508256", "SOURCE_DATASETID": "cc93796b-dc56-4789-b33d-d934de74fec0", "SOURCE_DATADESC": "740 TNMC Update 09/20/2016 16:14:05", "SOURCE_ORIGINATOR": "U.S. Geological Survey", "DATA_SECURITY": 5, "DISTRIBUTION_POLICY": "E4", "LOADDATE": "2016-09-20T21:51:36Z", "FTYPE": 740, "FCODE": 74026, "NAME": "San Marcos Pass Volunteer Fire Department", "ISLANDMARK": null, "POINTLOCATIONTYPE": 4, "ADMINTYPE": null, "ADDRESSBUILDINGNAME": null, "ADDRESS": "5593 West Camino Cielo Road", "CITY": "Santa Barbara", "STATE": "CA", "ZIPCODE": "93105", "GNIS_ID": "2665032", "FOOT_ID": null, "COMPLEX_ID": null, "GLOBALID": "{EAE71CAC-499A-4BDE-871D-DF3003EC21CD}" }, "geometry": { "type": "Point", "coordinates": [ -119.812210082999968, 34.504074097000057 ] } },
{ "type": "Feature", "properties": { "OBJECTID": 6274, "PERMANENT_IDENTIFIER": "{56233AD9-226C-4FD9-A4BD-EF8F89789BB3}", "SOURCE_FEATUREID": "10507424", "SOURCE_DATASETID": "cc93796b-dc56-4789-b33d-d934de74fec0", "SOURCE_DATADESC": "740 TNMC Update 09/20/2016 16:14:05", "SOURCE_ORIGINATOR": "U.S. Geological Survey", "DATA_SECURITY": 5, "DISTRIBUTION_POLICY": "E4", "LOADDATE": "2016-09-20T22:58:42Z", "FTYPE": 740, "FCODE": 74026, "NAME": "Vandenberg Air Force Base Fire Department Station 5", "ISLANDMARK": null, "POINTLOCATIONTYPE": 4, "ADMINTYPE": null, "ADDRESSBUILDINGNAME": null, "ADDRESS": "Surf Road", "CITY": "Vandenberg Air Force Base", "STATE": "CA", "ZIPCODE": "93437", "GNIS_ID": "2664827", "FOOT_ID": null, "COMPLEX_ID": null, "GLOBALID": "{DA4B5114-1B2B-473E-8FDB-418FDECD2915}" }, "geometry": { "type": "Point", "coordinates": [ -120.613029479999966, 34.648395538000045 ] } },
{ "type": "Feature", "properties": { "OBJECTID": 6275, "PERMANENT_IDENTIFIER": "{C74F0FAC-B403-44FA-AD6A-E61928954C54}", "SOURCE_FEATUREID": "10522561", "SOURCE_DATASETID": "cc93796b-dc56-4789-b33d-d934de74fec0", "SOURCE_DATADESC": "740 TNMC Update 09/20/2016 16:14:05", "SOURCE_ORIGINATOR": "U.S. Geological Survey", "DATA_SECURITY": 5, "DISTRIBUTION_POLICY": "E4", "LOADDATE": "2016-09-20T22:58:58Z", "FTYPE": 740, "FCODE": 74026, "NAME": "Vandenberg Air Force Base Fire Department Station 4", "ISLANDMARK": null, "POINTLOCATIONTYPE": 4, "ADMINTYPE": null, "ADDRESSBUILDINGNAME": null, "ADDRESS": "Arguello Road", "CITY": "Vandenberg Air Force Base", "STATE": "CA", "ZIPCODE": "93437", "GNIS_ID": "2664753", "FOOT_ID": null, "COMPLEX_ID": null, "GLOBALID": "{19632278-6670-47D7-8F7F-07F16DA87AE3}" }, "geometry": { "type": "Point", "coordinates": [ -120.569869994999976, 34.612518310000041 ] } },
{ "type": "Feature", "properties": { "OBJECTID": 6298, "PERMANENT_IDENTIFIER": "{561F1E4E-B0C2-4471-8CE7-8B7C705B4234}", "SOURCE_FEATUREID": "10508414", "SOURCE_DATASETID": "b056407f-d99b-4b82-bf13-d6e8d4209ea9", "SOURCE_DATADESC": "740 TNMC Update 09/20/2016 23:18:37", "SOURCE_ORIGINATOR": "U.S. Geological Survey", "DATA_SECURITY": 5, "DISTRIBUTION_POLICY": "E4", "LOADDATE": "2016-09-20T23:58:42Z", "FTYPE": 740, "FCODE": 74026, "NAME": "Vandenberg Air Force Base Fire Department Station 1", "ISLANDMARK": null, "POINTLOCATIONTYPE": 4, "ADMINTYPE": null, "ADDRESSBUILDINGNAME": null, "ADDRESS": "Airfield Road", "CITY": "Vandenberg Air Force Base", "STATE": "CA", "ZIPCODE": "93437", "GNIS_ID": "2664752", "FOOT_ID": null, "COMPLEX_ID": null, "GLOBALID": "{B295732D-A4F0-4B35-9BBB-8A6F06ED7B14}" }, "geometry": { "type": "Point", "coordinates": [ -120.568969725999978, 34.734226226000033 ] } },
{ "type": "Feature", "properties": { "OBJECTID": 6299, "PERMANENT_IDENTIFIER": "{5B5A16A5-EC07-4703-996F-5F3ED4CC6C37}", "SOURCE_FEATUREID": "10522562", "SOURCE_DATASETID": "b056407f-d99b-4b82-bf13-d6e8d4209ea9", "SOURCE_DATADESC": "740 TNMC Update 09/20/2016 23:18:37", "SOURCE_ORIGINATOR": "U.S. Geological Survey", "DATA_SECURITY": 5, "DISTRIBUTION_POLICY": "E4", "LOADDATE": "2016-09-21T00:09:22Z", "FTYPE": 740, "FCODE": 74026, "NAME": "Vandenberg Air Force Base Fire Department Station 3", "ISLANDMARK": null, "POINTLOCATIONTYPE": 4, "ADMINTYPE": null, "ADDRESSBUILDINGNAME": null, "ADDRESS": "El Rancho Road", "CITY": "Vandenberg Air Force Base", "STATE": "CA", "ZIPCODE": "93437", "GNIS_ID": "2664755", "FOOT_ID": null, "COMPLEX_ID": null, "GLOBALID": "{FC53E7FC-BB51-4E4D-9DAC-46592C684C6D}" }, "geometry": { "type": "Point", "coordinates": [ -120.564552306999985, 34.78823471100003 ] } },
{ "type": "Feature", "properties": { "OBJECTID": 6314, "PERMANENT_IDENTIFIER": "{CC515064-17A1-45F8-9C65-C450856109CD}", "SOURCE_FEATUREID": "10522110", "SOURCE_DATASETID": "b056407f-d99b-4b82-bf13-d6e8d4209ea9", "SOURCE_DATADESC": "740 TNMC Update 09/20/2016 23:18:37", "SOURCE_ORIGINATOR": "U.S. Geological Survey", "DATA_SECURITY": 5, "DISTRIBUTION_POLICY": "E4", "LOADDATE": "2016-09-21T01:01:30Z", "FTYPE": 740, "FCODE": 74026, "NAME": "Santa Barbara County Fire Department Station 31", "ISLANDMARK": null, "POINTLOCATIONTYPE": 1, "ADMINTYPE": null, "ADDRESSBUILDINGNAME": null, "ADDRESS": "168 West State Highway 246", "CITY": "Buellton", "STATE": "CA", "ZIPCODE": "93427", "GNIS_ID": "2664758", "FOOT_ID": null, "COMPLEX_ID": null, "GLOBALID": "{698B26C6-B677-4016-90C3-A7EF8D89235B}" }, "geometry": { "type": "Point", "coordinates": [ -120.196823119999976, 34.613201141000047 ] } },
{ "type": "Feature", "properties": { "OBJECTID": 7827, "PERMANENT_IDENTIFIER": "{C3B03688-72B4-4E0F-A40F-F69D5AF3E600}", "SOURCE_FEATUREID": "10470675", "SOURCE_DATASETID": "{CC44F99C-6658-4584-B606-926E498D5C82}", "SOURCE_DATADESC": "TNMC VWE DB Build - Vol Update", "SOURCE_ORIGINATOR": "U.S. Geological Survey", "DATA_SECURITY": 5, "DISTRIBUTION_POLICY": "E4", "LOADDATE": "2015-06-26T11:19:54Z", "FTYPE": 740, "FCODE": 74026, "NAME": "Keno Rural Fire Protection District Station 3", "ISLANDMARK": 2, "POINTLOCATIONTYPE": 1, "ADMINTYPE": 0, "ADDRESSBUILDINGNAME": null, "ADDRESS": "8000 State Highway 66", "CITY": "Klamath Falls", "STATE": "OR", "ZIPCODE": "97601", "GNIS_ID": "2576580", "FOOT_ID": null, "COMPLEX_ID": null, "GLOBALID": "{2B318B08-E051-43C5-A66B-DD27B6973A29}" }, "geometry": { "type": "Point", "coordinates": [ -121.850388137999971, 42.165314068000043 ] } },
{ "type": "Feature", "properties": { "OBJECTID": 7843, "PERMANENT_IDENTIFIER": "{8B059B37-9129-4645-8169-0F08F4E7EA2B}", "SOURCE_FEATUREID": "10462787", "SOURCE_DATASETID": "{CC44F99C-6658-4584-B606-926E498D5C82}", "SOURCE_DATADESC": "TNMC VWE DB Build - Vol Update", "SOURCE_ORIGINATOR": "U.S. Geological Survey", "DATA_SECURITY": 5, "DISTRIBUTION_POLICY": "E4", "LOADDATE": "2015-09-04T08:31:09Z", "FTYPE": 740, "FCODE": 74026, "NAME": "Beryl Fire Department", "ISLANDMARK": 2, "POINTLOCATIONTYPE": 1, "ADMINTYPE": null, "ADDRESSBUILDINGNAME": null, "ADDRESS": "650 East Center Street", "CITY": "Beryl Junction", "STATE": "UT", "ZIPCODE": "84714", "GNIS_ID": "2627442", "FOOT_ID": null, "COMPLEX_ID": null, "GLOBALID": "{6C454DE0-4C87-46A8-96BE-0C25DFE85E73}" }, "geometry": { "type": "Point", "coordinates": [ -113.642675747999988, 37.707665453000061 ] } },
{ "type": "Feature", "properties": { "OBJECTID": 7862, "PERMANENT_IDENTIFIER": "9f548e39-f2f9-42e9-b871-3a27235660c2", "SOURCE_FEATUREID": "10461954", "SOURCE_DATASETID": "{CC44F99C-6658-4584-B606-926E498D5C82}", "SOURCE_DATADESC": "TNMC VWE DB Build - Vol Update", "SOURCE_ORIGINATOR": "U.S. Geological Survey", "DATA_SECURITY": 5, "DISTRIBUTION_POLICY": "E4", "LOADDATE": "2015-06-26T11:19:54Z", "FTYPE": 740, "FCODE": 74026, "NAME": "Applegate Valley Rural Fire Protection District 9 Station 3 Headquarters", "ISLANDMARK": 2, "POINTLOCATIONTYPE": 1, "ADMINTYPE": 0, "ADDRESSBUILDINGNAME": null, "ADDRESS": "1095 Upper Applegate Road", "CITY": "Jacksonville", "STATE": "OR", "ZIPCODE": "97530", "GNIS_ID": "2576639", "FOOT_ID": " ", "COMPLEX_ID": null, "GLOBALID": "{FB76719A-609C-456F-9832-358C25FE68A7}" }, "geometry": { "type": "Point", "coordinates": [ -123.046986799999956, 42.22329079900004 ] } },
{ "type": "Feature", "properties": { "OBJECTID": 7865, "PERMANENT_IDENTIFIER": "{3412FAEB-002A-4DEB-BB82-B3C36AEA9955}", "SOURCE_FEATUREID": "10470343", "SOURCE_DATASETID": "{CC44F99C-6658-4584-B606-926E498D5C82}", "SOURCE_DATADESC": "TNMC VWE DB Build - Vol Update", "SOURCE_ORIGINATOR": "U.S. Geological Survey", "DATA_SECURITY": 5, "DISTRIBUTION_POLICY": "E4", "LOADDATE": "2015-06-26T11:19:54Z", "FTYPE": 740, "FCODE": 74026, "NAME": "Rural / Metro Fire Department Station 4", "ISLANDMARK": 2, "POINTLOCATIONTYPE": 1, "ADMINTYPE": 0, "ADDRESSBUILDINGNAME": null, "ADDRESS": "8199 Redwood Highway", "CITY": "Grants Pass", "STATE": "OR", "ZIPCODE": "97527", "GNIS_ID": "2576774", "FOOT_ID": null, "COMPLEX_ID": null, "GLOBALID": "{F7B9EA54-533E-415A-B19B-E5B09EC704FC}" }, "geometry": { "type": "Point", "coordinates": [ -123.475575529999958, 42.383002540000064 ] } },
{ "type": "Feature", "properties": { "OBJECTID": 7903, "PERMANENT_IDENTIFIER": "b2c17ef1-4c59-43cc-ace4-6c8d3e5f1804", "SOURCE_FEATUREID": "10139383", "SOURCE_DATASETID": "{CC44F99C-6658-4584-B606-926E498D5C82}", "SOURCE_DATADESC": "TNMC VWE DB Build - Vol Update", "SOURCE_ORIGINATOR": "U.S. Geological Survey", "DATA_SECURITY": 5, "DISTRIBUTION_POLICY": "E4", "LOADDATE": "2015-09-04T08:31:09Z", "FTYPE": 740, "FCODE": 74026, "NAME": "Wendover City Fire Department", "ISLANDMARK": 0, "POINTLOCATIONTYPE": 1, "ADMINTYPE": 0, "ADDRESSBUILDINGNAME": null, "ADDRESS": "151 South 9th", "CITY": "Wendover", "STATE": "UT", "ZIPCODE": "84083", "GNIS_ID": "2627175", "FOOT_ID": " ", "COMPLEX_ID": null, "GLOBALID": "{F6174562-278F-49E1-BAF3-5804672DA087}" }, "geometry": { "type": "Point", "coordinates": [ -114.031147862999944, 40.737305946000049 ] } },
{ "type": "Feature", "properties": { "OBJECTID": 7920, "PERMANENT_IDENTIFIER": "{0F87C299-1991-47B8-B600-FF5DB168C6E1}", "SOURCE_FEATUREID": "10470403", "SOURCE_DATASETID": "{CC44F99C-6658-4584-B606-926E498D5C82}", "SOURCE_DATADESC": "TNMC VWE DB Build - Vol Update", "SOURCE_ORIGINATOR": "U.S. Geological Survey", "DATA_SECURITY": 5, "DISTRIBUTION_POLICY": "E4", "LOADDATE": "2015-06-26T11:19:54Z", "FTYPE": 740, "FCODE": 74026, "NAME": "Illinois Valley Fire District Station 4", "ISLANDMARK": 2, "POINTLOCATIONTYPE": 4, "ADMINTYPE": 0, "ADDRESSBUILDINGNAME": null, "ADDRESS": "5465 Holland Loop Road", "CITY": "Cave Junction", "STATE": "OR", "ZIPCODE": "97523", "GNIS_ID": "2577053", "FOOT_ID": null, "COMPLEX_ID": null, "GLOBALID": "{854BE7A4-72A4-448C-9BED-AA6655E23A02}" }, "geometry": { "type": "Point", "coordinates": [ -123.572407744999964, 42.124895286000026 ] } },
{ "type": "Feature", "properties": { "OBJECTID": 7937, "PERMANENT_IDENTIFIER": "b3b1e9e4-e296-41f7-82c3-f96888506d8e", "SOURCE_FEATUREID": "10461945", "SOURCE_DATASETID": "{CC44F99C-6658-4584-B606-926E498D5C82}", "SOURCE_DATADESC": "TNMC VWE DB Build - Vol Update", "SOURCE_ORIGINATOR": "U.S. Geological Survey", "DATA_SECURITY": 5, "DISTRIBUTION_POLICY": "E4", "LOADDATE": "2015-06-26T11:19:54Z", "FTYPE": 740, "FCODE": 74026, "NAME": "Applegate Valley Rural Fire Protection District 9 Station 4", "ISLANDMARK": 2, "POINTLOCATIONTYPE": 1, "ADMINTYPE": 0, "ADDRESSBUILDINGNAME": null, "ADDRESS": "12100 Williams Highway", "CITY": "Grants Pass", "STATE": "OR", "ZIPCODE": "97527", "GNIS_ID": "2576525", "FOOT_ID": " ", "COMPLEX_ID": null, "GLOBALID": "{8ACA83FF-90B6-401C-B6CD-5573D933AE09}" }, "geometry": { "type": "Point", "coordinates": [ -123.259639532999984, 42.303021723000029 ] } },
{ "type": "Feature", "properties": { "OBJECTID": 7974, "PERMANENT_IDENTIFIER": "{C1332CC1-ADF5-4CD8-BB0B-239C78870A32}", "SOURCE_FEATUREID": "10470402", "SOURCE_DATASETID": "{CC44F99C-6658-4584-B606-926E498D5C82}", "SOURCE_DATADESC": "TNMC VWE DB Build - Vol Update", "SOURCE_ORIGINATOR": "U.S. Geological Survey", "DATA_SECURITY": 5, "DISTRIBUTION_POLICY": "E4", "LOADDATE": "2015-06-26T11:19:54Z", "FTYPE": 740, "FCODE": 74026, "NAME": "Illinois Valley Fire District Station 3", "ISLANDMARK": 2, "POINTLOCATIONTYPE": 1, "ADMINTYPE": 0, "ADDRESSBUILDINGNAME": null, "ADDRESS": "10 Lone Mountain Road", "CITY": "Obrien", "STATE": "OR", "ZIPCODE": "97534", "GNIS_ID": "2576683", "FOOT_ID": null, "COMPLEX_ID": null, "GLOBALID": "{5342199F-97AC-4A5A-A20C-C71FBF10B3A7}" }, "geometry": { "type": "Point", "coordinates": [ -123.70407447599996, 42.067494269000065 ] } },
{ "type": "Feature", "properties": { "OBJECTID": 8003, "PERMANENT_IDENTIFIER": "{B0B6D5E3-AD5D-41B2-ACF6-16A9CD242A47}", "SOURCE_FEATUREID": "10461937", "SOURCE_DATASETID": "{CC44F99C-6658-4584-B606-926E498D5C82}", "SOURCE_DATADESC": "TNMC VWE DB Build - Vol Update", "SOURCE_ORIGINATOR": "U.S. Geological Survey", "DATA_SECURITY": 5, "DISTRIBUTION_POLICY": "E4", "LOADDATE": "2015-06-26T11:19:54Z", "FTYPE": 740, "FCODE": 74026, "NAME": "Klamath County Fire District 1 Station 1", "ISLANDMARK": 2, "POINTLOCATIONTYPE": 1, "ADMINTYPE": 0, "ADDRESSBUILDINGNAME": null, "ADDRESS": "2342 Gettle Street", "CITY": "Klamath Falls", "STATE": "OR", "ZIPCODE": "97603", "GNIS_ID": "2576964", "FOOT_ID": null, "COMPLEX_ID": null, "GLOBALID": "{BE653081-F37B-426F-A244-369AA136CDD9}" }, "geometry": { "type": "Point", "coordinates": [ -121.732977318999986, 42.205868458000054 ] } },
{ "type": "Feature", "properties": { "OBJECTID": 8027, "PERMANENT_IDENTIFIER": "{407E7803-C8BB-4810-BFC5-5148C8A1A9B5}", "SOURCE_FEATUREID": "10461935", "SOURCE_DATASETID": "{CC44F99C-6658-4584-B606-926E498D5C82}", "SOURCE_DATADESC": "TNMC VWE DB Build - Vol Update", "SOURCE_ORIGINATOR": "U.S. Geological Survey", "DATA_SECURITY": 5, "DISTRIBUTION_POLICY": "E4", "LOADDATE": "2015-06-26T11:19:54Z", "FTYPE": 740, "FCODE": 74026, "NAME": "Klamath County Fire District 1 Station 3", "ISLANDMARK": 2, "POINTLOCATIONTYPE": 1, "ADMINTYPE": 0, "ADDRESSBUILDINGNAME": null, "ADDRESS": "1661 Mitchell Street", "CITY": "Klamath Falls", "STATE": "OR", "ZIPCODE": "97601", "GNIS_ID": "2576966", "FOOT_ID": null, "COMPLEX_ID": null, "GLOBALID": "{790FCFFF-B0E1-4D0E-AFBD-AB4AFAA96B98}" }, "geometry": { "type": "Point", "coordinates": [ -121.759535372999949, 42.214133810000078 ] } },
{ "type": "Feature", "properties": { "OBJECTID": 8028, "PERMANENT_IDENTIFIER": "{0F841012-FF81-4760-92EF-F5662A828456}", "SOURCE_FEATUREID": "10461934", "SOURCE_DATASETID": "{CC44F99C-6658-4584-B606-926E498D5C82}", "SOURCE_DATADESC": "TNMC VWE DB Build - Vol Update", "SOURCE_ORIGINATOR": "U.S. Geological Survey", "DATA_SECURITY": 5, "DISTRIBUTION_POLICY": "E4", "LOADDATE": "2015-06-26T11:19:54Z", "FTYPE": 740, "FCODE": 74026, "NAME": "Klamath County Fire District 1 Station 4", "ISLANDMARK": 2, "POINTLOCATIONTYPE": 1, "ADMINTYPE": 0, "ADDRESSBUILDINGNAME": null, "ADDRESS": "2581 Dahlia Street", "CITY": "Klamath Falls", "STATE": "OR", "ZIPCODE": "97601", "GNIS_ID": "2576967", "FOOT_ID": null, "COMPLEX_ID": null, "GLOBALID": "{496F7C72-7B3E-41F5-8377-6D7E85BD5BF2}" }, "geometry": { "type": "Point", "coordinates": [ -121.789084701999968, 42.249026331000039 ] } },
{ "type": "Feature", "properties": { "OBJECTID": 8030, "PERMANENT_IDENTIFIER": "6ffbc7c4-e29c-4b18-89ec-e6452ed11a94", "SOURCE_FEATUREID": "10461957", "SOURCE_DATASETID": "{CC44F99C-6658-4584-B606-926E498D5C82}", "SOURCE_DATADESC": "TNMC VWE DB Build - Vol Update", "SOURCE_ORIGINATOR": "U.S. Geological Survey", "DATA_SECURITY": 5, "DISTRIBUTION_POLICY": "E4", "LOADDATE": "2015-06-26T11:19:54Z", "FTYPE": 740, "FCODE": 74026, "NAME": "Jacksonville Fire Department", "ISLANDMARK": 2, "POINTLOCATIONTYPE": 4, "ADMINTYPE": 0, "ADDRESSBUILDINGNAME": null, "ADDRESS": "180 North 3rd Street", "CITY": "Jacksonville", "STATE": "OR", "ZIPCODE": "97530", "GNIS_ID": "2576651", "FOOT_ID": " ", "COMPLEX_ID": null, "GLOBALID": "{7B931E51-A75F-4097-B338-379C1916B76F}" }, "geometry": { "type": "Point", "coordinates": [ -122.967219100999955, 42.314638198000068 ] } },
{ "type": "Feature", "properties": { "OBJECTID": 8033, "PERMANENT_IDENTIFIER": "{57DB44F6-F5CD-4D24-8841-4A1E00940AED}", "SOURCE_FEATUREID": "10461953", "SOURCE_DATASETID": "{CC44F99C-6658-4584-B606-926E498D5C82}", "SOURCE_DATADESC": "TNMC VWE DB Build - Vol Update", "SOURCE_ORIGINATOR": "U.S. Geological Survey", "DATA_SECURITY": 5, "DISTRIBUTION_POLICY": "E4", "LOADDATE": "2015-06-26T11:19:54Z", "FTYPE": 740, "FCODE": 74026, "NAME": "Medford Fire Department Station 3", "ISLANDMARK": 2, "POINTLOCATIONTYPE": 1, "ADMINTYPE": 0, "ADDRESSBUILDINGNAME": null, "ADDRESS": "530 Highland Drive", "CITY": "Medford", "STATE": "OR", "ZIPCODE": "97504", "GNIS_ID": "2576956", "FOOT_ID": null, "COMPLEX_ID": null, "GLOBALID": "{8CA67ECA-7AAE-4481-B59C-C1BF89B9AABB}" }, "geometry": { "type": "Point", "coordinates": [ -122.850213914, 42.320665512000062 ] } },
{ "type": "Feature", "properties": { "OBJECTID": 8034, "PERMANENT_IDENTIFIER": "{0616705C-1970-4C2D-8F03-4D344F42A1FC}", "SOURCE_FEATUREID": "10461952", "SOURCE_DATASETID": "{CC44F99C-6658-4584-B606-926E498D5C82}", "SOURCE_DATADESC": "TNMC VWE DB Build - Vol Update", "SOURCE_ORIGINATOR": "U.S. Geological Survey", "DATA_SECURITY": 5, "DISTRIBUTION_POLICY": "E4", "LOADDATE": "2015-06-26T11:19:54Z", "FTYPE": 740, "FCODE": 74026, "NAME": "Medford Fire Department Station 4", "ISLANDMARK": 2, "POINTLOCATIONTYPE": 1, "ADMINTYPE": 0, "ADDRESSBUILDINGNAME": null, "ADDRESS": "2208 Table Rock Road", "CITY": "Medford", "STATE": "OR", "ZIPCODE": "97501", "GNIS_ID": "2576957", "FOOT_ID": null, "COMPLEX_ID": null, "GLOBALID": "{8EFD1885-9CBB-41BF-B4EE-917BE73B5E10}" }, "geometry": { "type": "Point", "coordinates": [ -122.882082568999977, 42.350066723000054 ] } },
{ "type": "Feature", "properties": { "OBJECTID": 8077, "PERMANENT_IDENTIFIER": "{D9BC4841-09F5-40A6-9F5B-52A0D5CB891A}", "SOURCE_FEATUREID": "10462976", "SOURCE_DATASETID": "{CC44F99C-6658-4584-B606-926E498D5C82}", "SOURCE_DATADESC": "TNMC VWE DB Build - Vol Update", "SOURCE_ORIGINATOR": "U.S. Geological Survey", "DATA_SECURITY": 5, "DISTRIBUTION_POLICY": "E4", "LOADDATE": "2015-09-04T08:31:09Z", "FTYPE": 740, "FCODE": 74026, "NAME": "Winchester Hills Volunteer Fire Department", "ISLANDMARK": 2, "POINTLOCATIONTYPE": 1, "ADMINTYPE": null, "ADDRESSBUILDINGNAME": null, "ADDRESS": "1190 West 5830 North", "CITY": "Saint George", "STATE": "UT", "ZIPCODE": "84770", "GNIS_ID": "2627267", "FOOT_ID": null, "COMPLEX_ID": null, "GLOBALID": "{AC61114F-29BD-4F82-9949-CD4411E296FB}" }, "geometry": { "type": "Point", "coordinates": [ -113.608815424999989, 37.211488178000025 ] } },
{ "type": "Feature", "properties": { "OBJECTID": 8138, "PERMANENT_IDENTIFIER": "{66C8FF50-65D6-4FA5-9069-4F4FFB9C08AD}", "SOURCE_FEATUREID": "10462996", "SOURCE_DATASETID": "{CC44F99C-6658-4584-B606-926E498D5C82}", "SOURCE_DATADESC": "TNMC VWE DB Build - Vol Update", "SOURCE_ORIGINATOR": "U.S. Geological Survey", "DATA_SECURITY": 5, "DISTRIBUTION_POLICY": "E4", "LOADDATE": "2015-09-04T08:31:09Z", "FTYPE": 740, "FCODE": 74026, "NAME": "Gunlock Fire Department - Northwestern Special Service Fire District", "ISLANDMARK": 2, "POINTLOCATIONTYPE": 4, "ADMINTYPE": null, "ADDRESSBUILDINGNAME": null, "ADDRESS": "423 North Main Street", "CITY": "Gunlock", "STATE": "UT", "ZIPCODE": "84733", "GNIS_ID": "2627357", "FOOT_ID": null, "COMPLEX_ID": null, "GLOBALID": "{51F31D67-494B-43D5-B292-876BBA8625E4}" }, "geometry": { "type": "Point", "coordinates": [ -113.763345059999949, 37.288383361000058 ] } },
{ "type": "Feature", "properties": { "OBJECTID": 8143, "PERMANENT_IDENTIFIER": "{40093B60-F249-4C8B-93B3-3846E4420C32}", "SOURCE_FEATUREID": "10462043", "SOURCE_DATASETID": "{CC44F99C-6658-4584-B606-926E498D5C82}", "SOURCE_DATADESC": "TNMC VWE DB Build - Vol Update", "SOURCE_ORIGINATOR": "U.S. Geological Survey", "DATA_SECURITY": 5, "DISTRIBUTION_POLICY": "E4", "LOADDATE": "2015-06-26T11:19:54Z", "FTYPE": 740, "FCODE": 74026, "NAME": "Cape Ferrelo Rural Fire Protection District", "ISLANDMARK": 2, "POINTLOCATIONTYPE": 1, "ADMINTYPE": 0, "ADDRESSBUILDINGNAME": null, "ADDRESS": "96349 Cape Ferrelo Road", "CITY": "Brookings", "STATE": "OR", "ZIPCODE": "97415", "GNIS_ID": "2576887", "FOOT_ID": null, "COMPLEX_ID": null, "GLOBALID": "{070D0DB6-B94D-43C1-81C6-361F7ACA2943}" }, "geometry": { "type": "Point", "coordinates": [ -124.322884573999943, 42.125835189000043 ] } },
{ "type": "Feature", "properties": { "OBJECTID": 8234, "PERMANENT_IDENTIFIER": "12afc56a-0675-43d4-ab56-048957cbc13d", "SOURCE_FEATUREID": "10461927", "SOURCE_DATASETID": "{CC44F99C-6658-4584-B606-926E498D5C82}", "SOURCE_DATADESC": "TNMC VWE DB Build - Vol Update", "SOURCE_ORIGINATOR": "U.S. Geological Survey", "DATA_SECURITY": 5, "DISTRIBUTION_POLICY": "E4", "LOADDATE": "2015-06-26T11:19:54Z", "FTYPE": 740, "FCODE": 74026, "NAME": "Lakeview Fire Department", "ISLANDMARK": 2, "POINTLOCATIONTYPE": 4, "ADMINTYPE": 0, "ADDRESSBUILDINGNAME": null, "ADDRESS": "245 North F Street", "CITY": "Lakeview", "STATE": "OR", "ZIPCODE": "97630", "GNIS_ID": "2576528", "FOOT_ID": " ", "COMPLEX_ID": null, "GLOBALID": "{65F738F7-3DFC-4A15-9FCE-52FEB7478854}" }, "geometry": { "type": "Point", "coordinates": [ -120.346425746999955, 42.191691714000058 ] } },
{ "type": "Feature", "properties": { "OBJECTID": 8281, "PERMANENT_IDENTIFIER": "8dfa0f5f-4d73-48eb-8b7a-e8bfd3a7a60b", "SOURCE_FEATUREID": "10461958", "SOURCE_DATASETID": "{CC44F99C-6658-4584-B606-926E498D5C82}", "SOURCE_DATADESC": "TNMC VWE DB Build - Vol Update", "SOURCE_ORIGINATOR": "U.S. Geological Survey", "DATA_SECURITY": 5, "DISTRIBUTION_POLICY": "E4", "LOADDATE": "2015-06-26T11:19:54Z", "FTYPE": 740, "FCODE": 74026, "NAME": "Jackson County Fire District 5", "ISLANDMARK": 2, "POINTLOCATIONTYPE": 4, "ADMINTYPE": 0, "ADDRESSBUILDINGNAME": null, "ADDRESS": "5811 South Pacific Highway", "CITY": "Phoenix", "STATE": "OR", "ZIPCODE": "97535", "GNIS_ID": "2576470", "FOOT_ID": " ", "COMPLEX_ID": null, "GLOBALID": "{2A4ACB77-16A6-477D-9CD8-4ABDD1FC32F8}" }, "geometry": { "type": "Point", "coordinates": [ -122.790727135999987, 42.251009114000055 ] } },
{ "type": "Feature", "properties": { "OBJECTID": 8293, "PERMANENT_IDENTIFIER": "{303E2573-B63B-4D41-8B74-BEE0D6F6CA1B}", "SOURCE_FEATUREID": null, "SOURCE_DATASETID": "{CC44F99C-6658-4584-B606-926E498D5C82}", "SOURCE_DATADESC": "TNMC VWE DB Build - Vol Update", "SOURCE_ORIGINATOR": "U.S. Geological Survey", "DATA_SECURITY": 5, "DISTRIBUTION_POLICY": "E4", "LOADDATE": "2015-09-04T08:31:09Z", "FTYPE": 740, "FCODE": 74026, "NAME": "Veyo Fire Station - Northwestern Special Service Fire District", "ISLANDMARK": 2, "POINTLOCATIONTYPE": 1, "ADMINTYPE": null, "ADDRESSBUILDINGNAME": null, "ADDRESS": "59 East Center Street", "CITY": "Veyo", "STATE": "UT", "ZIPCODE": "84782", "GNIS_ID": "2768503", "FOOT_ID": null, "COMPLEX_ID": null, "GLOBALID": "{1DB24D46-CBD5-4DA1-8F11-497CF1BC3E99}" }, "geometry": { "type": "Point", "coordinates": [ -113.691827614999966, 37.338343784000074 ] } },
{ "type": "Feature", "properties": { "OBJECTID": 8327, "PERMANENT_IDENTIFIER": "{72942D58-64A7-420C-A330-9E508250D433}", "SOURCE_FEATUREID": "10472193", "SOURCE_DATASETID": "{CC44F99C-6658-4584-B606-926E498D5C82}", "SOURCE_DATADESC": "TNMC VWE DB Build - Vol Update", "SOURCE_ORIGINATOR": "U.S. Geological Survey", "DATA_SECURITY": 5, "DISTRIBUTION_POLICY": "E4", "LOADDATE": "2015-09-04T08:31:09Z", "FTYPE": 740, "FCODE": 74026, "NAME": "Saint George Fire Department Station 7", "ISLANDMARK": 2, "POINTLOCATIONTYPE": 1, "ADMINTYPE": null, "ADDRESSBUILDINGNAME": null, "ADDRESS": "1912 West 1800 North", "CITY": "Saint George", "STATE": "UT", "ZIPCODE": "84770", "GNIS_ID": "2627252", "FOOT_ID": null, "COMPLEX_ID": null, "GLOBALID": "{2E654961-CAEC-4CF7-9694-2FEC0813D3EE}" }, "geometry": { "type": "Point", "coordinates": [ -113.624594928999954, 37.139772878000031 ] } },
{ "type": "Feature", "properties": { "OBJECTID": 8335, "PERMANENT_IDENTIFIER": "{416BAD8F-26E7-489A-BCC1-41860C18930D}", "SOURCE_FEATUREID": "10461955", "SOURCE_DATASETID": "{CC44F99C-6658-4584-B606-926E498D5C82}", "SOURCE_DATADESC": "TNMC VWE DB Build - Vol Update", "SOURCE_ORIGINATOR": "U.S. Geological Survey", "DATA_SECURITY": 5, "DISTRIBUTION_POLICY": "E4", "LOADDATE": "2015-06-26T11:19:54Z", "FTYPE": 740, "FCODE": 74026, "NAME": "Rogue Valley International Medford Airport Fire Department", "ISLANDMARK": 2, "POINTLOCATIONTYPE": 1, "ADMINTYPE": 0, "ADDRESSBUILDINGNAME": null, "ADDRESS": "3650 Biddle Road", "CITY": "Medford", "STATE": "OR", "ZIPCODE": "97504", "GNIS_ID": "2576955", "FOOT_ID": null, "COMPLEX_ID": null, "GLOBALID": "{82CEC7D0-F3F5-4557-8E48-EC7D702466EA}" }, "geometry": { "type": "Point", "coordinates": [ -122.872381771, 42.367235249000032 ] } },
{ "type": "Feature", "properties": { "OBJECTID": 8348, "PERMANENT_IDENTIFIER": "{92557AE4-C109-4C03-AF8C-B7D8EB638768}", "SOURCE_FEATUREID": "10461961", "SOURCE_DATASETID": "{CC44F99C-6658-4584-B606-926E498D5C82}", "SOURCE_DATADESC": "TNMC VWE DB Build - Vol Update", "SOURCE_ORIGINATOR": "U.S. Geological Survey", "DATA_SECURITY": 5, "DISTRIBUTION_POLICY": "E4", "LOADDATE": "2015-06-26T11:19:54Z", "FTYPE": 740, "FCODE": 74026, "NAME": "Applegate Valley Rural Fire Protection District 9 Station 1", "ISLANDMARK": 2, "POINTLOCATIONTYPE": 1, "ADMINTYPE": 0, "ADDRESSBUILDINGNAME": null, "ADDRESS": "18489 North Applegate Road", "CITY": "Grants Pass", "STATE": "OR", "ZIPCODE": "97527", "GNIS_ID": "2576712", "FOOT_ID": null, "COMPLEX_ID": null, "GLOBALID": "{96E66B8A-0658-4C32-9CD7-9CAEFC85A4D3}" }, "geometry": { "type": "Point", "coordinates": [ -123.170673622999971, 42.256814064000025 ] } },
{ "type": "Feature", "properties": { "OBJECTID": 8350, "PERMANENT_IDENTIFIER": "{54217D2C-4F5C-48A4-8252-D397F6B1A039}", "SOURCE_FEATUREID": "10461963", "SOURCE_DATASETID": "{CC44F99C-6658-4584-B606-926E498D5C82}", "SOURCE_DATADESC": "TNMC VWE DB Build - Vol Update", "SOURCE_ORIGINATOR": "U.S. Geological Survey", "DATA_SECURITY": 5, "DISTRIBUTION_POLICY": "E4", "LOADDATE": "2016-08-12T13:19:58Z", "FTYPE": 740, "FCODE": 74026, "NAME": "Applegate Valley Rural Fire Protection District 9 Station 5", "ISLANDMARK": 2, "POINTLOCATIONTYPE": 1, "ADMINTYPE": 0, "ADDRESSBUILDINGNAME": null, "ADDRESS": "2170 State Highway 238", "CITY": "Jacksonville", "STATE": "OR", "ZIPCODE": "97530", "GNIS_ID": "2576717", "FOOT_ID": null, "COMPLEX_ID": null, "GLOBALID": "{8BEF2DB6-BD08-41A2-9322-6043436CBA42}" }, "geometry": { "type": "Point", "coordinates": [ -122.993943931, 42.292792274000078 ] } },
{ "type": "Feature", "properties": { "OBJECTID": 8421, "PERMANENT_IDENTIFIER": "9566eb7a-aac8-4abf-b3e0-9924eb4faaae", "SOURCE_FEATUREID": "10461932", "SOURCE_DATASETID": "{CC44F99C-6658-4584-B606-926E498D5C82}", "SOURCE_DATADESC": "TNMC VWE DB Build - Vol Update", "SOURCE_ORIGINATOR": "U.S. Geological Survey", "DATA_SECURITY": 5, "DISTRIBUTION_POLICY": "E4", "LOADDATE": "2015-06-26T11:19:54Z", "FTYPE": 740, "FCODE": 74026, "NAME": "Bonanza Rural Fire Protection District", "ISLANDMARK": 2, "POINTLOCATIONTYPE": 1, "ADMINTYPE": 0, "ADDRESSBUILDINGNAME": null, "ADDRESS": "2849 Market Street", "CITY": "Bonanza", "STATE": "OR", "ZIPCODE": "97623", "GNIS_ID": "2576653", "FOOT_ID": " ", "COMPLEX_ID": null, "GLOBALID": "{EEF32F86-06EC-43FA-8056-8A924C81D3D0}" }, "geometry": { "type": "Point", "coordinates": [ -121.400314563999984, 42.199546339000051 ] } },
{ "type": "Feature", "properties": { "OBJECTID": 8440, "PERMANENT_IDENTIFIER": "49591066-ee57-4c00-abcd-ecd7340153d2", "SOURCE_FEATUREID": "10462042", "SOURCE_DATASETID": "{CC44F99C-6658-4584-B606-926E498D5C82}", "SOURCE_DATADESC": "TNMC VWE DB Build - Vol Update", "SOURCE_ORIGINATOR": "U.S. Geological Survey", "DATA_SECURITY": 5, "DISTRIBUTION_POLICY": "E4", "LOADDATE": "2015-06-26T11:19:54Z", "FTYPE": 740, "FCODE": 74026, "NAME": "Harbor Rural Fire Protection District", "ISLANDMARK": 2, "POINTLOCATIONTYPE": 1, "ADMINTYPE": 0, "ADDRESSBUILDINGNAME": null, "ADDRESS": "98069 West Benham Lane", "CITY": "Harbor", "STATE": "OR", "ZIPCODE": "97415", "GNIS_ID": "2576587", "FOOT_ID": " ", "COMPLEX_ID": null, "GLOBALID": "{DFB5B220-D67A-48EA-A904-750DB894A284}" }, "geometry": { "type": "Point", "coordinates": [ -124.254794538999988, 42.042844001000049 ] } },
{ "type": "Feature", "properties": { "OBJECTID": 8518, "PERMANENT_IDENTIFIER": "{14A1337C-DF46-4A44-BD88-0A2F7A4CCE97}", "SOURCE_FEATUREID": "10462894", "SOURCE_DATASETID": "{CC44F99C-6658-4584-B606-926E498D5C82}", "SOURCE_DATADESC": "TNMC VWE DB Build - Vol Update", "SOURCE_ORIGINATOR": "U.S. Geological Survey", "DATA_SECURITY": 5, "DISTRIBUTION_POLICY": "E4", "LOADDATE": "2015-09-04T08:31:09Z", "FTYPE": 740, "FCODE": 74026, "NAME": "Partoun Fire Department", "ISLANDMARK": 2, "POINTLOCATIONTYPE": 4, "ADMINTYPE": null, "ADDRESSBUILDINGNAME": null, "ADDRESS": "Corner Road and Partoun Cutoff Road", "CITY": "Partoun", "STATE": "UT", "ZIPCODE": "84083", "GNIS_ID": "2627421", "FOOT_ID": null, "COMPLEX_ID": null, "GLOBALID": "{7A71BF0C-E186-4130-B7D4-72096FC691A1}" }, "geometry": { "type": "Point", "coordinates": [ -113.885691874999964, 39.632792281000036 ] } },
{ "type": "Feature", "properties": { "OBJECTID": 8583, "PERMANENT_IDENTIFIER": "{3AA5ACA6-9AF2-43C4-992C-8C35A2B8B1E3}", "SOURCE_FEATUREID": "10462225", "SOURCE_DATASETID": "{CC44F99C-6658-4584-B606-926E498D5C82}", "SOURCE_DATADESC": "TNMC VWE DB Build - Vol Update", "SOURCE_ORIGINATOR": "U.S. Geological Survey", "DATA_SECURITY": 5, "DISTRIBUTION_POLICY": "E4", "LOADDATE": "2015-06-26T11:19:54Z", "FTYPE": 740, "FCODE": 74026, "NAME": "Merrill Rural Fire Protection District", "ISLANDMARK": 2, "POINTLOCATIONTYPE": 1, "ADMINTYPE": 0, "ADDRESSBUILDINGNAME": null, "ADDRESS": "216 Main Street", "CITY": "Merrill", "STATE": "OR", "ZIPCODE": "97633", "GNIS_ID": "2576707", "FOOT_ID": null, "COMPLEX_ID": null, "GLOBALID": "{1AD9F4A2-6F41-4F27-9743-CEA276C686B9}" }, "geometry": { "type": "Point", "coordinates": [ -121.600814840999988, 42.026974263000056 ] } },
{ "type": "Feature", "properties": { "OBJECTID": 8587, "PERMANENT_IDENTIFIER": "{9BA96504-3001-4851-B127-45718D341C7D}", "SOURCE_FEATUREID": "10139411", "SOURCE_DATASETID": "{CC44F99C-6658-4584-B606-926E498D5C82}", "SOURCE_DATADESC": "TNMC VWE DB Build - Vol Update", "SOURCE_ORIGINATOR": "U.S. Geological Survey", "DATA_SECURITY": 5, "DISTRIBUTION_POLICY": "E4", "LOADDATE": "2015-09-04T08:31:09Z", "FTYPE": 740, "FCODE": 74026, "NAME": "Northwestern Special Service Fire District Brookside Station", "ISLANDMARK": 2, "POINTLOCATIONTYPE": 4, "ADMINTYPE": null, "ADDRESSBUILDINGNAME": null, "ADDRESS": "436 Wells Fargo Drive", "CITY": "Veyo", "STATE": "UT", "ZIPCODE": "84782", "GNIS_ID": "2627393", "FOOT_ID": null, "COMPLEX_ID": null, "GLOBALID": "{35933FA1-7D00-4DDE-8213-B85D16563A8C}" }, "geometry": { "type": "Point", "coordinates": [ -113.657708806999949, 37.366392510000026 ] } },
{ "type": "Feature", "properties": { "OBJECTID": 8647, "PERMANENT_IDENTIFIER": "{6FEC598B-0B42-40AB-8B34-1F1098A7D9A2}", "SOURCE_FEATUREID": "10461929", "SOURCE_DATASETID": "{CC44F99C-6658-4584-B606-926E498D5C82}", "SOURCE_DATADESC": "TNMC VWE DB Build - Vol Update", "SOURCE_ORIGINATOR": "U.S. Geological Survey", "DATA_SECURITY": 5, "DISTRIBUTION_POLICY": "E4", "LOADDATE": "2015-06-26T11:19:54Z", "FTYPE": 740, "FCODE": 74026, "NAME": "Klamath County Fire District 4", "ISLANDMARK": 2, "POINTLOCATIONTYPE": 1, "ADMINTYPE": 0, "ADDRESSBUILDINGNAME": null, "ADDRESS": "4041 Balsam Drive", "CITY": "Klamath Falls", "STATE": "OR", "ZIPCODE": "97601", "GNIS_ID": "2576970", "FOOT_ID": null, "COMPLEX_ID": null, "GLOBALID": "{56C0B6D1-7D42-499E-9A1B-AAA56A20084C}" }, "geometry": { "type": "Point", "coordinates": [ -121.808003693999979, 42.19209621400006 ] } },
{ "type": "Feature", "properties": { "OBJECTID": 8654, "PERMANENT_IDENTIFIER": "{65B12E60-AECF-4705-8805-B1E7C5635D56}", "SOURCE_FEATUREID": "10463129", "SOURCE_DATASETID": "{CC44F99C-6658-4584-B606-926E498D5C82}", "SOURCE_DATADESC": "TNMC VWE DB Build - Vol Update", "SOURCE_ORIGINATOR": "U.S. Geological Survey", "DATA_SECURITY": 5, "DISTRIBUTION_POLICY": "E4", "LOADDATE": "2015-09-04T08:31:09Z", "FTYPE": 740, "FCODE": 74026, "NAME": "Santa Clara Fire Department Station 2", "ISLANDMARK": 2, "POINTLOCATIONTYPE": 1, "ADMINTYPE": null, "ADDRESSBUILDINGNAME": null, "ADDRESS": "2365 Rachel Drive", "CITY": "Santa Clara", "STATE": "UT", "ZIPCODE": "84765", "GNIS_ID": "2627264", "FOOT_ID": null, "COMPLEX_ID": null, "GLOBALID": "{7DD3575C-5E4A-49CE-AE16-9733F610D651}" }, "geometry": { "type": "Point", "coordinates": [ -113.66134459899996, 37.14851389200004 ] } },
{ "type": "Feature", "properties": { "OBJECTID": 8753, "PERMANENT_IDENTIFIER": "7678337b-bc73-410e-9edc-f05fbbea05a3", "SOURCE_FEATUREID": "10139439", "SOURCE_DATASETID": "{CC44F99C-6658-4584-B606-926E498D5C82}", "SOURCE_DATADESC": "TNMC VWE DB Build - Vol Update", "SOURCE_ORIGINATOR": "U.S. Geological Survey", "DATA_SECURITY": 5, "DISTRIBUTION_POLICY": "E4", "LOADDATE": "2015-06-26T11:19:54Z", "FTYPE": 740, "FCODE": 74026, "NAME": "Medford Fire and Rescue Station 2", "ISLANDMARK": 2, "POINTLOCATIONTYPE": 1, "ADMINTYPE": 0, "ADDRESSBUILDINGNAME": null, "ADDRESS": "1241 West 8th Street", "CITY": "Medford", "STATE": "OR", "ZIPCODE": "97501", "GNIS_ID": "2576517", "FOOT_ID": " ", "COMPLEX_ID": null, "GLOBALID": "{AE7DF070-0B63-4038-BD20-3A0967FCE667}" }, "geometry": { "type": "Point", "coordinates": [ -122.886837319, 42.32220671500005 ] } },
{ "type": "Feature", "properties": { "OBJECTID": 8888, "PERMANENT_IDENTIFIER": "{2545F2DC-D067-458B-863E-744DD38F2EC8}", "SOURCE_FEATUREID": "10479235", "SOURCE_DATASETID": "{CC44F99C-6658-4584-B606-926E498D5C82}", "SOURCE_DATADESC": "TNMC VWE DB Build - Vol Update", "SOURCE_ORIGINATOR": "U.S. Geological Survey", "DATA_SECURITY": 5, "DISTRIBUTION_POLICY": "E4", "LOADDATE": "2015-06-26T11:19:54Z", "FTYPE": 740, "FCODE": 74026, "NAME": "Fremont Winema National Forest Fire Center", "ISLANDMARK": 2, "POINTLOCATIONTYPE": 4, "ADMINTYPE": 0, "ADDRESSBUILDINGNAME": null, "ADDRESS": "1000 South 9th Street", "CITY": "Lakeview", "STATE": "OR", "ZIPCODE": "97630", "GNIS_ID": "2576659", "FOOT_ID": null, "COMPLEX_ID": null, "GLOBALID": "{C0D70675-6A87-4941-9CDA-AF559280F448}" }, "geometry": { "type": "Point", "coordinates": [ -120.351352783999971, 42.179075866000062 ] } },
{ "type": "Feature", "properties": { "OBJECTID": 8901, "PERMANENT_IDENTIFIER": "{55F2DF3D-3A6E-48DA-930B-45DAAADBA7C4}", "SOURCE_FEATUREID": "10479810", "SOURCE_DATASETID": "{CC44F99C-6658-4584-B606-926E498D5C82}", "SOURCE_DATADESC": "TNMC VWE DB Build - Vol Update", "SOURCE_ORIGINATOR": "U.S. Geological Survey", "DATA_SECURITY": 5, "DISTRIBUTION_POLICY": "E4", "LOADDATE": "2015-06-26T11:19:54Z", "FTYPE": 740, "FCODE": 74026, "NAME": "United States Forest Service Applegate Ranger District", "ISLANDMARK": 2, "POINTLOCATIONTYPE": 0, "ADMINTYPE": 0, "ADDRESSBUILDINGNAME": null, "ADDRESS": "6941 Upper Applegate Road", "CITY": "Jacksonville", "STATE": "OR", "ZIPCODE": "97530", "GNIS_ID": "2577060", "FOOT_ID": null, "COMPLEX_ID": null, "GLOBALID": "{48895BEB-E9C0-43ED-9BA5-267289F3F372}" }, "geometry": { "type": "Point", "coordinates": [ -123.059144130999982, 42.150010623000071 ] } },
{ "type": "Feature", "properties": { "OBJECTID": 8944, "PERMANENT_IDENTIFIER": "{D457FE7D-5A5C-4030-86CA-6183A24069A7}", "SOURCE_FEATUREID": "10470404", "SOURCE_DATASETID": "{CC44F99C-6658-4584-B606-926E498D5C82}", "SOURCE_DATADESC": "TNMC VWE DB Build - Vol Update", "SOURCE_ORIGINATOR": "U.S. Geological Survey", "DATA_SECURITY": 5, "DISTRIBUTION_POLICY": "E4", "LOADDATE": "2015-06-26T11:19:54Z", "FTYPE": 740, "FCODE": 74026, "NAME": "Illinois Valley Fire District Station 5", "ISLANDMARK": 2, "POINTLOCATIONTYPE": 4, "ADMINTYPE": 0, "ADDRESSBUILDINGNAME": null, "ADDRESS": "4240 Lake Shore Drive", "CITY": "Selma", "STATE": "OR", "ZIPCODE": "97538", "GNIS_ID": "2576682", "FOOT_ID": null, "COMPLEX_ID": null, "GLOBALID": "{B89823DB-4975-4FDA-8724-C025759B897C}" }, "geometry": { "type": "Point", "coordinates": [ -123.550137383999981, 42.265706575000081 ] } },
{ "type": "Feature", "properties": { "OBJECTID": 8945, "PERMANENT_IDENTIFIER": "{383EAF8E-E368-43E2-A01B-BDE639B24F15}", "SOURCE_FEATUREID": "10470400", "SOURCE_DATASETID": "{CC44F99C-6658-4584-B606-926E498D5C82}", "SOURCE_DATADESC": "TNMC VWE DB Build - Vol Update", "SOURCE_ORIGINATOR": "U.S. Geological Survey", "DATA_SECURITY": 5, "DISTRIBUTION_POLICY": "E4", "LOADDATE": "2015-06-26T11:19:54Z", "FTYPE": 740, "FCODE": 74026, "NAME": "Illinois Valley Fire District Station 2", "ISLANDMARK": 2, "POINTLOCATIONTYPE": 1, "ADMINTYPE": 0, "ADDRESSBUILDINGNAME": null, "ADDRESS": "18455 Redwood Highway", "CITY": "Selma", "STATE": "OR", "ZIPCODE": "97538", "GNIS_ID": "2576685", "FOOT_ID": null, "COMPLEX_ID": null, "GLOBALID": "{2BD0A66F-403D-4B7F-B0D0-03BEBE1FE414}" }, "geometry": { "type": "Point", "coordinates": [ -123.616166659999976, 42.276938549000079 ] } },
{ "type": "Feature", "properties": { "OBJECTID": 9011, "PERMANENT_IDENTIFIER": "{F7896163-DCCE-4AB9-9B9C-E2AD69D485AA}", "SOURCE_FEATUREID": "10461960", "SOURCE_DATASETID": "{CC44F99C-6658-4584-B606-926E498D5C82}", "SOURCE_DATADESC": "TNMC VWE DB Build - Vol Update", "SOURCE_ORIGINATOR": "U.S. Geological Survey", "DATA_SECURITY": 5, "DISTRIBUTION_POLICY": "E4", "LOADDATE": "2015-06-26T11:19:54Z", "FTYPE": 740, "FCODE": 74026, "NAME": "Jackson County Fire District 3 Central Point Station", "ISLANDMARK": 2, "POINTLOCATIONTYPE": 1, "ADMINTYPE": 0, "ADDRESSBUILDINGNAME": null, "ADDRESS": "600 South Front Street", "CITY": "Central Point", "STATE": "OR", "ZIPCODE": "97502", "GNIS_ID": "2576954", "FOOT_ID": null, "COMPLEX_ID": null, "GLOBALID": "{7A7676D0-C804-4F8C-99C1-91894A1C2731}" }, "geometry": { "type": "Point", "coordinates": [ -122.912942169999951, 42.368840768000041 ] } },
{ "type": "Feature", "properties": { "OBJECTID": 9012, "PERMANENT_IDENTIFIER": "{F0458047-5CF9-41A9-A3FF-0D9425594C67}", "SOURCE_FEATUREID": "10461940", "SOURCE_DATASETID": "{CC44F99C-6658-4584-B606-926E498D5C82}", "SOURCE_DATADESC": "TNMC VWE DB Build - Vol Update", "SOURCE_ORIGINATOR": "U.S. Geological Survey", "DATA_SECURITY": 5, "DISTRIBUTION_POLICY": "E4", "LOADDATE": "2015-06-26T11:19:54Z", "FTYPE": 740, "FCODE": 74026, "NAME": "Klamath County Fire District 1 Station 6 Headquarters", "ISLANDMARK": 2, "POINTLOCATIONTYPE": 1, "ADMINTYPE": 0, "ADDRESSBUILDINGNAME": null, "ADDRESS": "143 North Broad Street", "CITY": "Klamath Falls", "STATE": "OR", "ZIPCODE": "97601", "GNIS_ID": "2576962", "FOOT_ID": null, "COMPLEX_ID": null, "GLOBALID": "{69730352-5C00-4DF4-85AE-6A15DEE0D6EC}" }, "geometry": { "type": "Point", "coordinates": [ -121.775424172999976, 42.229117151000025 ] } },
{ "type": "Feature", "properties": { "OBJECTID": 9016, "PERMANENT_IDENTIFIER": "b9fbb6f8-dba2-446f-8f1b-9a793fb39609", "SOURCE_FEATUREID": "10462368", "SOURCE_DATASETID": "{CC44F99C-6658-4584-B606-926E498D5C82}", "SOURCE_DATADESC": "TNMC VWE DB Build - Vol Update", "SOURCE_ORIGINATOR": "U.S. Geological Survey", "DATA_SECURITY": 5, "DISTRIBUTION_POLICY": "E4", "LOADDATE": "2015-06-26T11:19:54Z", "FTYPE": 740, "FCODE": 74026, "NAME": "Brookings Fire and Rescue", "ISLANDMARK": 2, "POINTLOCATIONTYPE": 1, "ADMINTYPE": 0, "ADDRESSBUILDINGNAME": null, "ADDRESS": "898 Elk Drive", "CITY": "Brookings", "STATE": "OR", "ZIPCODE": "97415", "GNIS_ID": "2576534", "FOOT_ID": " ", "COMPLEX_ID": null, "GLOBALID": "{A518A07E-9348-4E14-8A22-7802F3FABFD2}" }, "geometry": { "type": "Point", "coordinates": [ -124.287440107999942, 42.055394869000054 ] } },
{ "type": "Feature", "properties": { "OBJECTID": 9018, "PERMANENT_IDENTIFIER": "{2A8CC57F-686E-49EB-A9F8-63D7916AAF0A}", "SOURCE_FEATUREID": "10461962", "SOURCE_DATASETID": "{CC44F99C-6658-4584-B606-926E498D5C82}", "SOURCE_DATADESC": "TNMC VWE DB Build - Vol Update", "SOURCE_ORIGINATOR": "U.S. Geological Survey", "DATA_SECURITY": 5, "DISTRIBUTION_POLICY": "E4", "LOADDATE": "2015-06-26T11:19:54Z", "FTYPE": 740, "FCODE": 74026, "NAME": "Applegate Valley Rural Fire Protection District 9 Station 2", "ISLANDMARK": 2, "POINTLOCATIONTYPE": 1, "ADMINTYPE": 0, "ADDRESSBUILDINGNAME": null, "ADDRESS": "7774 Upper Applegate Road", "CITY": "Jacksonville", "STATE": "OR", "ZIPCODE": "97530", "GNIS_ID": "2576702", "FOOT_ID": null, "COMPLEX_ID": null, "GLOBALID": "{6E3D6B48-8340-4354-8B78-65CA92F3F9E4}" }, "geometry": { "type": "Point", "coordinates": [ -123.068056099999978, 42.140325217000054 ] } },
{ "type": "Feature", "properties": { "OBJECTID": 9094, "PERMANENT_IDENTIFIER": "{5B5EC732-9743-48BF-A47A-6B1B268E4FEE}", "SOURCE_FEATUREID": "10462951", "SOURCE_DATASETID": "{CC44F99C-6658-4584-B606-926E498D5C82}", "SOURCE_DATADESC": "TNMC VWE DB Build - Vol Update", "SOURCE_ORIGINATOR": "U.S. Geological Survey", "DATA_SECURITY": 5, "DISTRIBUTION_POLICY": "E4", "LOADDATE": "2015-09-04T08:31:09Z", "FTYPE": 740, "FCODE": 74026, "NAME": "Saint George Fire Department Station 4", "ISLANDMARK": 2, "POINTLOCATIONTYPE": 1, "ADMINTYPE": null, "ADDRESSBUILDINGNAME": null, "ADDRESS": "3521 South Manzanita Road", "CITY": "Saint George", "STATE": "UT", "ZIPCODE": "84790", "GNIS_ID": "2627223", "FOOT_ID": null, "COMPLEX_ID": null, "GLOBALID": "{A2741564-F6A7-40D7-A9B8-EA5DF51C3ED4}" }, "geometry": { "type": "Point", "coordinates": [ -113.606359526999938, 37.047307256000067 ] } },
{ "type": "Feature", "properties": { "OBJECTID": 9096, "PERMANENT_IDENTIFIER": "7c3f88ab-6f99-45e0-becc-036528ca9dba", "SOURCE_FEATUREID": "10462815", "SOURCE_DATASETID": "{CC44F99C-6658-4584-B606-926E498D5C82}", "SOURCE_DATADESC": "TNMC VWE DB Build - Vol Update", "SOURCE_ORIGINATOR": "U.S. Geological Survey", "DATA_SECURITY": 5, "DISTRIBUTION_POLICY": "E4", "LOADDATE": "2015-09-04T08:31:09Z", "FTYPE": 740, "FCODE": 74026, "NAME": "Enterprise Volunteer Fire Department", "ISLANDMARK": 0, "POINTLOCATIONTYPE": 1, "ADMINTYPE": 0, "ADDRESSBUILDINGNAME": null, "ADDRESS": "328 East 200 South Street", "CITY": "Enterprise", "STATE": "UT", "ZIPCODE": "84725", "GNIS_ID": "2627168", "FOOT_ID": " ", "COMPLEX_ID": null, "GLOBALID": "{DC48B791-C284-4599-92E3-B8C2ACAB55DF}" }, "geometry": { "type": "Point", "coordinates": [ -113.715918099999953, 37.569952447000048 ] } },
{ "type": "Feature", "properties": { "OBJECTID": 9100, "PERMANENT_IDENTIFIER": "{63DB9B75-B7FC-4A2F-959D-69C90713FA90}", "SOURCE_FEATUREID": "10462829", "SOURCE_DATASETID": "{CC44F99C-6658-4584-B606-926E498D5C82}", "SOURCE_DATADESC": "TNMC VWE DB Build - Vol Update", "SOURCE_ORIGINATOR": "U.S. Geological Survey", "DATA_SECURITY": 5, "DISTRIBUTION_POLICY": "E4", "LOADDATE": "2015-09-04T08:31:09Z", "FTYPE": 740, "FCODE": 74026, "NAME": "Granite Ranch Fire Department", "ISLANDMARK": 2, "POINTLOCATIONTYPE": 1, "ADMINTYPE": null, "ADDRESSBUILDINGNAME": null, "ADDRESS": "3540 Granite Ranch Road", "CITY": "Trout Creek", "STATE": "UT", "ZIPCODE": "84083", "GNIS_ID": "2627322", "FOOT_ID": null, "COMPLEX_ID": null, "GLOBALID": "{322A9368-B2C9-4C67-A7B4-A38831D50952}" }, "geometry": { "type": "Point", "coordinates": [ -113.737860722, 39.735313562000044 ] } },
{ "type": "Feature", "properties": { "OBJECTID": 9164, "PERMANENT_IDENTIFIER": "{992E90D1-E73E-4D42-8687-965DEAE11239}", "SOURCE_FEATUREID": "10461946", "SOURCE_DATASETID": "{CC44F99C-6658-4584-B606-926E498D5C82}", "SOURCE_DATADESC": "TNMC VWE DB Build - Vol Update", "SOURCE_ORIGINATOR": "U.S. Geological Survey", "DATA_SECURITY": 5, "DISTRIBUTION_POLICY": "E4", "LOADDATE": "2015-06-26T11:19:54Z", "FTYPE": 740, "FCODE": 74026, "NAME": "Applegate Valley Rural Fire Protection District 9 Station 6", "ISLANDMARK": 2, "POINTLOCATIONTYPE": 1, "ADMINTYPE": 0, "ADDRESSBUILDINGNAME": null, "ADDRESS": "1076 Kubli Road", "CITY": "Grants Pass", "STATE": "OR", "ZIPCODE": "97527", "GNIS_ID": "2576959", "FOOT_ID": null, "COMPLEX_ID": null, "GLOBALID": "{16E2C7A2-7ECF-4191-8452-F849965A2909}" }, "geometry": { "type": "Point", "coordinates": [ -123.229986985999972, 42.315512776000048 ] } },
{ "type": "Feature", "properties": { "OBJECTID": 9165, "PERMANENT_IDENTIFIER": "{591A5A76-BBF8-4746-8AFA-55027889E828}", "SOURCE_FEATUREID": "10461941", "SOURCE_DATASETID": "{CC44F99C-6658-4584-B606-926E498D5C82}", "SOURCE_DATADESC": "TNMC VWE DB Build - Vol Update", "SOURCE_ORIGINATOR": "U.S. Geological Survey", "DATA_SECURITY": 5, "DISTRIBUTION_POLICY": "E4", "LOADDATE": "2015-06-26T11:19:54Z", "FTYPE": 740, "FCODE": 74026, "NAME": "Klamath County Fire District 1 Station 5", "ISLANDMARK": 2, "POINTLOCATIONTYPE": 1, "ADMINTYPE": 0, "ADDRESSBUILDINGNAME": null, "ADDRESS": "4801 US Highway 97 North", "CITY": "Klamath Falls", "STATE": "OR", "ZIPCODE": "97601", "GNIS_ID": "2576961", "FOOT_ID": null, "COMPLEX_ID": null, "GLOBALID": "{E9184F59-F0DB-4F14-B005-8AE78758F49C}" }, "geometry": { "type": "Point", "coordinates": [ -121.809875032999969, 42.269155810000029 ] } },
{ "type": "Feature", "properties": { "OBJECTID": 9209, "PERMANENT_IDENTIFIER": "dbca4827-8a5b-4828-893b-66870eef5706", "SOURCE_FEATUREID": "10462278", "SOURCE_DATASETID": "{CC44F99C-6658-4584-B606-926E498D5C82}", "SOURCE_DATADESC": "TNMC VWE DB Build - Vol Update", "SOURCE_ORIGINATOR": "U.S. Geological Survey", "DATA_SECURITY": 5, "DISTRIBUTION_POLICY": "E4", "LOADDATE": "2015-06-26T11:19:54Z", "FTYPE": 740, "FCODE": 74026, "NAME": "Ashland Fire and Rescue Station 1", "ISLANDMARK": 2, "POINTLOCATIONTYPE": 1, "ADMINTYPE": 0, "ADDRESSBUILDINGNAME": null, "ADDRESS": "455 Siskiyou Boulevard", "CITY": "Ashland", "STATE": "OR", "ZIPCODE": "97520", "GNIS_ID": "2091246", "FOOT_ID": " ", "COMPLEX_ID": null, "GLOBALID": "{4B356053-F908-40A7-A1DC-689D90697233}" }, "geometry": { "type": "Point", "coordinates": [ -122.708438084999955, 42.19403923200008 ] } },
{ "type": "Feature", "properties": { "OBJECTID": 9295, "PERMANENT_IDENTIFIER": "{5477B089-0E6F-4E7C-B72E-D8407BC2263B}", "SOURCE_FEATUREID": "10470405", "SOURCE_DATASETID": "{CC44F99C-6658-4584-B606-926E498D5C82}", "SOURCE_DATADESC": "TNMC VWE DB Build - Vol Update", "SOURCE_ORIGINATOR": "U.S. Geological Survey", "DATA_SECURITY": 5, "DISTRIBUTION_POLICY": "E4", "LOADDATE": "2015-06-26T11:19:54Z", "FTYPE": 740, "FCODE": 74026, "NAME": "Illinois Valley Fire District Station 6", "ISLANDMARK": 2, "POINTLOCATIONTYPE": 4, "ADMINTYPE": 0, "ADDRESSBUILDINGNAME": null, "ADDRESS": "8399 Takilma Road", "CITY": "Cave Junction", "STATE": "OR", "ZIPCODE": "97523", "GNIS_ID": "2577115", "FOOT_ID": null, "COMPLEX_ID": null, "GLOBALID": "{BB523BCE-6347-4011-BC90-90A422BA6EC0}" }, "geometry": { "type": "Point", "coordinates": [ -123.612748096999951, 42.061737788000073 ] } },
{ "type": "Feature", "properties": { "OBJECTID": 9303, "PERMANENT_IDENTIFIER": "90939798-886b-42fc-8663-bb8813b89f55", "SOURCE_FEATUREID": "10168864", "SOURCE_DATASETID": "{CC44F99C-6658-4584-B606-926E498D5C82}", "SOURCE_DATADESC": "TNMC VWE DB Build - Vol Update", "SOURCE_ORIGINATOR": "U.S. Geological Survey", "DATA_SECURITY": 5, "DISTRIBUTION_POLICY": "E4", "LOADDATE": "2015-09-04T08:31:09Z", "FTYPE": 740, "FCODE": 74026, "NAME": "Ivins City Fire Department", "ISLANDMARK": 0, "POINTLOCATIONTYPE": 1, "ADMINTYPE": 0, "ADDRESSBUILDINGNAME": null, "ADDRESS": "90 West Center Street", "CITY": "Ivins", "STATE": "UT", "ZIPCODE": "84738", "GNIS_ID": "2627166", "FOOT_ID": " ", "COMPLEX_ID": null, "GLOBALID": "{255E38CC-9981-440E-AFA4-69331F809A03}" }, "geometry": { "type": "Point", "coordinates": [ -113.681292413999984, 37.16854513100003 ] } },
{ "type": "Feature", "properties": { "OBJECTID": 9329, "PERMANENT_IDENTIFIER": "03342a97-e4d3-4d9c-8ed4-86041e91d8fd", "SOURCE_FEATUREID": "10461964", "SOURCE_DATASETID": "{CC44F99C-6658-4584-B606-926E498D5C82}", "SOURCE_DATADESC": "TNMC VWE DB Build - Vol Update", "SOURCE_ORIGINATOR": "U.S. Geological Survey", "DATA_SECURITY": 5, "DISTRIBUTION_POLICY": "E4", "LOADDATE": "2015-06-26T11:19:54Z", "FTYPE": 740, "FCODE": 74026, "NAME": "Phoenix Fire Department", "ISLANDMARK": 2, "POINTLOCATIONTYPE": 1, "ADMINTYPE": 0, "ADDRESSBUILDINGNAME": null, "ADDRESS": "116 West 2nd Street", "CITY": "Phoenix", "STATE": "OR", "ZIPCODE": "97535", "GNIS_ID": "2576507", "FOOT_ID": " ", "COMPLEX_ID": null, "GLOBALID": "{7746FDA2-D96A-4639-8F11-84154ED6D8C9}" }, "geometry": { "type": "Point", "coordinates": [ -122.816973459999986, 42.274424792000048 ] } },
{ "type": "Feature", "properties": { "OBJECTID": 9372, "PERMANENT_IDENTIFIER": "{ACF7399B-2002-4461-A79F-56D3A54D1C51}", "SOURCE_FEATUREID": "10462767", "SOURCE_DATASETID": "{CC44F99C-6658-4584-B606-926E498D5C82}", "SOURCE_DATADESC": "TNMC VWE DB Build - Vol Update", "SOURCE_ORIGINATOR": "U.S. Geological Survey", "DATA_SECURITY": 5, "DISTRIBUTION_POLICY": "E4", "LOADDATE": "2015-09-04T08:31:09Z", "FTYPE": 740, "FCODE": 74026, "NAME": "Saint George Fire Department Station 5", "ISLANDMARK": 2, "POINTLOCATIONTYPE": 1, "ADMINTYPE": null, "ADDRESSBUILDINGNAME": null, "ADDRESS": "100 North Dixie Drive", "CITY": "Saint George", "STATE": "UT", "ZIPCODE": "84770", "GNIS_ID": "2627341", "FOOT_ID": null, "COMPLEX_ID": null, "GLOBALID": "{B92CD46F-B150-407D-A64E-B231C51B21A1}" }, "geometry": { "type": "Point", "coordinates": [ -113.619519653999987, 37.110937154000055 ] } },
{ "type": "Feature", "properties": { "OBJECTID": 9408, "PERMANENT_IDENTIFIER": "01e93c2e-9ccf-4e16-a656-d8f7b07745d0", "SOURCE_FEATUREID": "10461944", "SOURCE_DATASETID": "{CC44F99C-6658-4584-B606-926E498D5C82}", "SOURCE_DATADESC": "TNMC VWE DB Build - Vol Update", "SOURCE_ORIGINATOR": "U.S. Geological Survey", "DATA_SECURITY": 5, "DISTRIBUTION_POLICY": "E4", "LOADDATE": "2015-06-26T11:19:54Z", "FTYPE": 740, "FCODE": 74026, "NAME": "Williams Rural Fire Protection District", "ISLANDMARK": 2, "POINTLOCATIONTYPE": 1, "ADMINTYPE": 0, "ADDRESSBUILDINGNAME": null, "ADDRESS": "211 East Fork Road", "CITY": "Williams", "STATE": "OR", "ZIPCODE": "97544", "GNIS_ID": "2576491", "FOOT_ID": " ", "COMPLEX_ID": null, "GLOBALID": "{463D52E5-8FA9-4D79-9EA6-23908A7EC348}" }, "geometry": { "type": "Point", "coordinates": [ -123.273591660999955, 42.217818142000056 ] } },
{ "type": "Feature", "properties": { "OBJECTID": 9426, "PERMANENT_IDENTIFIER": "{5B5811C9-F7F0-4C81-9125-3379160C1E2F}", "SOURCE_FEATUREID": "10139455", "SOURCE_DATASETID": "{CC44F99C-6658-4584-B606-926E498D5C82}", "SOURCE_DATADESC": "TNMC VWE DB Build - Vol Update", "SOURCE_ORIGINATOR": "U.S. Geological Survey", "DATA_SECURITY": 5, "DISTRIBUTION_POLICY": "E4", "LOADDATE": "2015-06-26T11:19:54Z", "FTYPE": 740, "FCODE": 74026, "NAME": "Thomas Creek Rural Fire Department", "ISLANDMARK": 2, "POINTLOCATIONTYPE": 1, "ADMINTYPE": 0, "ADDRESSBUILDINGNAME": null, "ADDRESS": "18983 New Idaho Road", "CITY": "Lakeview", "STATE": "OR", "ZIPCODE": "97630", "GNIS_ID": "2576690", "FOOT_ID": null, "COMPLEX_ID": null, "GLOBALID": "{C6C9119C-6A1A-4C5D-9992-92F9B24F45DD}" }, "geometry": { "type": "Point", "coordinates": [ -120.434323813, 42.187051826000072 ] } },
{ "type": "Feature", "properties": { "OBJECTID": 9508, "PERMANENT_IDENTIFIER": "{003E6BFE-DC69-4D41-B125-9A86AB3C3DE9}", "SOURCE_FEATUREID": "10462832", "SOURCE_DATASETID": "{CC44F99C-6658-4584-B606-926E498D5C82}", "SOURCE_DATADESC": "TNMC VWE DB Build - Vol Update", "SOURCE_ORIGINATOR": "U.S. Geological Survey", "DATA_SECURITY": 5, "DISTRIBUTION_POLICY": "E4", "LOADDATE": "2015-09-04T08:31:09Z", "FTYPE": 740, "FCODE": 74026, "NAME": "Grouse Creek Fire Department", "ISLANDMARK": 2, "POINTLOCATIONTYPE": 1, "ADMINTYPE": null, "ADDRESSBUILDINGNAME": null, "ADDRESS": "11605 North Grouse Creek Road", "CITY": "Grouse Creek", "STATE": "UT", "ZIPCODE": "84313", "GNIS_ID": "2627245", "FOOT_ID": null, "COMPLEX_ID": null, "GLOBALID": "{16A8AB57-CFA3-4FD7-9737-D2621617BE84}" }, "geometry": { "type": "Point", "coordinates": [ -113.890740769, 41.706054822000056 ] } },
{ "type": "Feature", "properties": { "OBJECTID": 9539, "PERMANENT_IDENTIFIER": "{50364695-A00C-4FE9-B2B4-789F88D7CED1}", "SOURCE_FEATUREID": "10462273", "SOURCE_DATASETID": "{CC44F99C-6658-4584-B606-926E498D5C82}", "SOURCE_DATADESC": "TNMC VWE DB Build - Vol Update", "SOURCE_ORIGINATOR": "U.S. Geological Survey", "DATA_SECURITY": 5, "DISTRIBUTION_POLICY": "E4", "LOADDATE": "2015-06-26T11:19:54Z", "FTYPE": 740, "FCODE": 74026, "NAME": "Medford Fire Department Station 5", "ISLANDMARK": 2, "POINTLOCATIONTYPE": 1, "ADMINTYPE": 0, "ADDRESSBUILDINGNAME": null, "ADDRESS": "2124 Roberts Road", "CITY": "Medford", "STATE": "OR", "ZIPCODE": "97504", "GNIS_ID": "2576677", "FOOT_ID": null, "COMPLEX_ID": null, "GLOBALID": "{D7AF7214-7969-4FC5-BDA8-E4CA5927B96E}" }, "geometry": { "type": "Point", "coordinates": [ -122.852914871999985, 42.350825966000059 ] } },
{ "type": "Feature", "properties": { "OBJECTID": 9590, "PERMANENT_IDENTIFIER": "{936208B3-0B2A-42C6-867E-0F1A11488637}", "SOURCE_FEATUREID": "10462970", "SOURCE_DATASETID": "{CC44F99C-6658-4584-B606-926E498D5C82}", "SOURCE_DATADESC": "TNMC VWE DB Build - Vol Update", "SOURCE_ORIGINATOR": "U.S. Geological Survey", "DATA_SECURITY": 5, "DISTRIBUTION_POLICY": "E4", "LOADDATE": "2015-09-04T08:31:09Z", "FTYPE": 740, "FCODE": 74026, "NAME": "Wendover Airport Fire Department", "ISLANDMARK": 2, "POINTLOCATIONTYPE": 1, "ADMINTYPE": null, "ADDRESSBUILDINGNAME": null, "ADDRESS": "345 Airport Apron", "CITY": "Wendover", "STATE": "UT", "ZIPCODE": "84083", "GNIS_ID": "2627269", "FOOT_ID": null, "COMPLEX_ID": null, "GLOBALID": "{441A7C90-EF96-499A-85C7-A08B76619E9B}" }, "geometry": { "type": "Point", "coordinates": [ -114.031509478999965, 40.727977703000079 ] } },
{ "type": "Feature", "properties": { "OBJECTID": 9622, "PERMANENT_IDENTIFIER": "{8648D10B-FB28-420B-A78B-7E5DA674E2DF}", "SOURCE_FEATUREID": "10470680", "SOURCE_DATASETID": "{CC44F99C-6658-4584-B606-926E498D5C82}", "SOURCE_DATADESC": "TNMC VWE DB Build - Vol Update", "SOURCE_ORIGINATOR": "U.S. Geological Survey", "DATA_SECURITY": 5, "DISTRIBUTION_POLICY": "E4", "LOADDATE": "2015-06-26T11:19:54Z", "FTYPE": 740, "FCODE": 74026, "NAME": "Ashland Fire and Rescue Station 2", "ISLANDMARK": 2, "POINTLOCATIONTYPE": 4, "ADMINTYPE": 0, "ADDRESSBUILDINGNAME": null, "ADDRESS": "1600 Ashland Street", "CITY": "Ashland", "STATE": "OR", "ZIPCODE": "97520", "GNIS_ID": "2091247", "FOOT_ID": null, "COMPLEX_ID": null, "GLOBALID": "{522560AE-73D3-40E9-B18E-C50E11C3BBC4}" }, "geometry": { "type": "Point", "coordinates": [ -122.681699345999959, 42.185099623000042 ] } },
{ "type": "Feature", "properties": { "OBJECTID": 9624, "PERMANENT_IDENTIFIER": "{D86EFBD2-CE1C-4E04-A2BE-8DAAB79E788E}", "SOURCE_FEATUREID": "10479483", "SOURCE_DATASETID": "{CC44F99C-6658-4584-B606-926E498D5C82}", "SOURCE_DATADESC": "TNMC VWE DB Build - Vol Update", "SOURCE_ORIGINATOR": "U.S. Geological Survey", "DATA_SECURITY": 5, "DISTRIBUTION_POLICY": "E4", "LOADDATE": "2015-06-26T11:19:54Z", "FTYPE": 740, "FCODE": 74026, "NAME": "Kingsley Field Fire Department", "ISLANDMARK": 2, "POINTLOCATIONTYPE": 1, "ADMINTYPE": 0, "ADDRESSBUILDINGNAME": null, "ADDRESS": "216 Gentile Street", "CITY": "Klamath Falls", "STATE": "OR", "ZIPCODE": "97603", "GNIS_ID": "2576576", "FOOT_ID": null, "COMPLEX_ID": null, "GLOBALID": "{12E9B99A-2413-4ADA-8BAB-D18CAD736B80}" }, "geometry": { "type": "Point", "coordinates": [ -121.744330652999963, 42.16313329500008 ] } },
{ "type": "Feature", "properties": { "OBJECTID": 9641, "PERMANENT_IDENTIFIER": "{439125E2-7758-44C2-AF7F-50D527295091}", "SOURCE_FEATUREID": "10510816", "SOURCE_DATASETID": "{CC44F99C-6658-4584-B606-926E498D5C82}", "SOURCE_DATADESC": "TNMC VWE DB Build - Vol Update", "SOURCE_ORIGINATOR": "U.S. Geological Survey", "DATA_SECURITY": 5, "DISTRIBUTION_POLICY": "E4", "LOADDATE": "2015-04-10T09:14:15Z", "FTYPE": 740, "FCODE": 74026, "NAME": "Salmon Tract Rural Fire District Station 1", "ISLANDMARK": null, "POINTLOCATIONTYPE": 1, "ADMINTYPE": null, "ADDRESSBUILDINGNAME": null, "ADDRESS": "2411 East 2450 North", "CITY": "Twin Falls", "STATE": "ID", "ZIPCODE": "83301", "GNIS_ID": "2619242", "FOOT_ID": null, "COMPLEX_ID": null, "GLOBALID": "{EEF74193-5600-4F18-A366-813B99B97FB8}" }, "geometry": { "type": "Point", "coordinates": [ -114.572302176999983, 42.352969720000033 ] } },
{ "type": "Feature", "properties": { "OBJECTID": 9646, "PERMANENT_IDENTIFIER": "{74B8F2D0-CEC6-4CEF-9A7C-8DA8FC910F66}", "SOURCE_FEATUREID": null, "SOURCE_DATASETID": "{CC44F99C-6658-4584-B606-926E498D5C82}", "SOURCE_DATADESC": "TNMC VWE DB Build - Vol Update", "SOURCE_ORIGINATOR": "U.S. Geological Survey", "DATA_SECURITY": 5, "DISTRIBUTION_POLICY": "E4", "LOADDATE": "2015-09-04T08:31:09Z", "FTYPE": 740, "FCODE": 74026, "NAME": "Callao Fire Department", "ISLANDMARK": 2, "POINTLOCATIONTYPE": 1, "ADMINTYPE": null, "ADDRESSBUILDINGNAME": null, "ADDRESS": "5900 West Pony Express Road", "CITY": "Wendover", "STATE": "UT", "ZIPCODE": "84083", "GNIS_ID": "2627333", "FOOT_ID": null, "COMPLEX_ID": null, "GLOBALID": "{BBC9C9CB-ABE1-4226-8F5F-603615447A7A}" }, "geometry": { "type": "Point", "coordinates": [ -113.70834586899997, 39.897595522000074 ] } },
{ "type": "Feature", "properties": { "OBJECTID": 9648, "PERMANENT_IDENTIFIER": "{00624524-D8BC-4FF0-A361-C82308EB06E1}", "SOURCE_FEATUREID": "10462037", "SOURCE_DATASETID": "{CC44F99C-6658-4584-B606-926E498D5C82}", "SOURCE_DATADESC": "TNMC VWE DB Build - Vol Update", "SOURCE_ORIGINATOR": "U.S. Geological Survey", "DATA_SECURITY": 5, "DISTRIBUTION_POLICY": "E4", "LOADDATE": "2015-06-26T11:19:54Z", "FTYPE": 740, "FCODE": 74026, "NAME": "Winchuck Rural Fire Protection District", "ISLANDMARK": 2, "POINTLOCATIONTYPE": 1, "ADMINTYPE": 0, "ADDRESSBUILDINGNAME": null, "ADDRESS": "363 Winchuck River Road", "CITY": "Brookings", "STATE": "OR", "ZIPCODE": "97415", "GNIS_ID": "2576891", "FOOT_ID": null, "COMPLEX_ID": null, "GLOBALID": "{86DA744F-6CB2-4A55-A8A4-4D3433BD9C0D}" }, "geometry": { "type": "Point", "coordinates": [ -124.165824060999967, 42.034265703000074 ] } },
{ "type": "Feature", "properties": { "OBJECTID": 9651, "PERMANENT_IDENTIFIER": "{94ACFBF7-EDE0-4ADD-BB35-6D5B5A47BC8C}", "SOURCE_FEATUREID": "10462178", "SOURCE_DATASETID": "{CC44F99C-6658-4584-B606-926E498D5C82}", "SOURCE_DATADESC": "TNMC VWE DB Build - Vol Update", "SOURCE_ORIGINATOR": "U.S. Geological Survey", "DATA_SECURITY": 5, "DISTRIBUTION_POLICY": "E4", "LOADDATE": "2015-06-26T11:19:54Z", "FTYPE": 740, "FCODE": 74026, "NAME": "Medford Fire Department Station 6", "ISLANDMARK": 2, "POINTLOCATIONTYPE": 1, "ADMINTYPE": 0, "ADDRESSBUILDINGNAME": null, "ADDRESS": "3700 Barnett Road", "CITY": "Medford", "STATE": "OR", "ZIPCODE": "97504", "GNIS_ID": "2576656", "FOOT_ID": null, "COMPLEX_ID": null, "GLOBALID": "{B40DDD7C-72A5-44EA-BB2F-2334099BC008}" }, "geometry": { "type": "Point", "coordinates": [ -122.812163907999945, 42.316935251000075 ] } },
{ "type": "Feature", "properties": { "OBJECTID": 9665, "PERMANENT_IDENTIFIER": "{6075FCDA-90C4-4DCE-B11A-1935D53ACCC0}", "SOURCE_FEATUREID": "10139443", "SOURCE_DATASETID": "{CC44F99C-6658-4584-B606-926E498D5C82}", "SOURCE_DATADESC": "TNMC VWE DB Build - Vol Update", "SOURCE_ORIGINATOR": "U.S. Geological Survey", "DATA_SECURITY": 5, "DISTRIBUTION_POLICY": "E4", "LOADDATE": "2015-06-26T11:19:54Z", "FTYPE": 740, "FCODE": 74026, "NAME": "Westside Rural Fire Department", "ISLANDMARK": 2, "POINTLOCATIONTYPE": 1, "ADMINTYPE": 0, "ADDRESSBUILDINGNAME": null, "ADDRESS": "15547 Westside Road", "CITY": "Lakeview", "STATE": "OR", "ZIPCODE": "97630", "GNIS_ID": "2577059", "FOOT_ID": null, "COMPLEX_ID": null, "GLOBALID": "{CC1309C2-1599-4FBE-B54B-BF19F48E3AC5}" }, "geometry": { "type": "Point", "coordinates": [ -120.493216939999968, 42.113956388000076 ] } },
{ "type": "Feature", "properties": { "OBJECTID": 9686, "PERMANENT_IDENTIFIER": "{BE0D8872-F7C2-4BE2-90B5-BF22AC7BB558}", "SOURCE_FEATUREID": null, "SOURCE_DATASETID": "{CC44F99C-6658-4584-B606-926E498D5C82}", "SOURCE_DATADESC": "TNMC VWE DB Build - Vol Update", "SOURCE_ORIGINATOR": "U.S. Geological Survey", "DATA_SECURITY": 5, "DISTRIBUTION_POLICY": "E4", "LOADDATE": "2015-09-04T08:31:09Z", "FTYPE": 740, "FCODE": 74026, "NAME": "Santa Clara Fire Department Station 1", "ISLANDMARK": 2, "POINTLOCATIONTYPE": 1, "ADMINTYPE": null, "ADDRESSBUILDINGNAME": null, "ADDRESS": "2771 Circle Drive", "CITY": "Santa Clara", "STATE": "UT", "ZIPCODE": "84765", "GNIS_ID": "2768484", "FOOT_ID": null, "COMPLEX_ID": null, "GLOBALID": "{1DD086A4-BA4D-42E5-A18C-068163D685ED}" }, "geometry": { "type": "Point", "coordinates": [ -113.648914499999989, 37.133489500000053 ] } },
{ "type": "Feature", "properties": { "OBJECTID": 9985, "PERMANENT_IDENTIFIER": "{E1E2BFA7-35F5-4E64-85F3-24EBD3ED2620}", "SOURCE_FEATUREID": "10470350", "SOURCE_DATASETID": "{CC44F99C-6658-4584-B606-926E498D5C82}", "SOURCE_DATADESC": "TNMC VWE DB Build - Vol Update", "SOURCE_ORIGINATOR": "U.S. Geological Survey", "DATA_SECURITY": 5, "DISTRIBUTION_POLICY": "E4", "LOADDATE": "2015-06-26T11:19:54Z", "FTYPE": 740, "FCODE": 74026, "NAME": "Rural / Metro Fire Department Station 7", "ISLANDMARK": 2, "POINTLOCATIONTYPE": 4, "ADMINTYPE": 0, "ADDRESSBUILDINGNAME": null, "ADDRESS": "481 Southside Road", "CITY": "Grants Pass", "STATE": "OR", "ZIPCODE": "97527", "GNIS_ID": "2577119", "FOOT_ID": null, "COMPLEX_ID": null, "GLOBALID": "{AA94D714-4CA6-4BC3-A9AE-2FA9B741FF72}" }, "geometry": { "type": "Point", "coordinates": [ -123.338503084999957, 42.337533994000069 ] } },
{ "type": "Feature", "properties": { "OBJECTID": 10020, "PERMANENT_IDENTIFIER": "{E0E6DEF7-17F1-4B4C-AF72-1BD621432936}", "SOURCE_FEATUREID": null, "SOURCE_DATASETID": "{CC44F99C-6658-4584-B606-926E498D5C82}", "SOURCE_DATADESC": "TNMC VWE DB Build - Vol Update", "SOURCE_ORIGINATOR": "U.S. Geological Survey", "DATA_SECURITY": 5, "DISTRIBUTION_POLICY": "E4", "LOADDATE": "2015-09-04T08:31:09Z", "FTYPE": 740, "FCODE": 74026, "NAME": "Central Fire Statiion - Northwestern Special Service Fire District", "ISLANDMARK": 2, "POINTLOCATIONTYPE": 1, "ADMINTYPE": null, "ADDRESSBUILDINGNAME": null, "ADDRESS": "155 East Center", "CITY": "Central", "STATE": "UT", "ZIPCODE": "84722", "GNIS_ID": "2768442", "FOOT_ID": null, "COMPLEX_ID": null, "GLOBALID": "{CB81D9A9-38F6-479D-A416-D54F02EB81EE}" }, "geometry": { "type": "Point", "coordinates": [ -113.628679308999949, 37.41722622900005 ] } },
{ "type": "Feature", "properties": { "OBJECTID": 10141, "PERMANENT_IDENTIFIER": "{5316F604-FBE8-42E9-BF41-657690042F94}", "SOURCE_FEATUREID": "10510786", "SOURCE_DATASETID": "{CC44F99C-6658-4584-B606-926E498D5C82}", "SOURCE_DATADESC": "TNMC VWE DB Build - Vol Update", "SOURCE_ORIGINATOR": "U.S. Geological Survey", "DATA_SECURITY": 5, "DISTRIBUTION_POLICY": "E4", "LOADDATE": "2015-04-10T09:14:15Z", "FTYPE": 740, "FCODE": 74026, "NAME": "Oakley Fire Department", "ISLANDMARK": null, "POINTLOCATIONTYPE": 4, "ADMINTYPE": null, "ADDRESSBUILDINGNAME": null, "ADDRESS": "315 East Main Street", "CITY": "Oakley", "STATE": "ID", "ZIPCODE": "83346", "GNIS_ID": "2619203", "FOOT_ID": null, "COMPLEX_ID": null, "GLOBALID": "{1ECE24F0-B00B-44E3-B3C7-C12FC2AAE8E1}" }, "geometry": { "type": "Point", "coordinates": [ -113.876635809, 42.24338038500008 ] } },
{ "type": "Feature", "properties": { "OBJECTID": 10168, "PERMANENT_IDENTIFIER": "{FAD83378-45E3-43D0-8A6F-0C9DDEF43DE7}", "SOURCE_FEATUREID": "10462169", "SOURCE_DATASETID": "{CC44F99C-6658-4584-B606-926E498D5C82}", "SOURCE_DATADESC": "TNMC VWE DB Build - Vol Update", "SOURCE_ORIGINATOR": "U.S. Geological Survey", "DATA_SECURITY": 5, "DISTRIBUTION_POLICY": "E4", "LOADDATE": "2015-06-26T11:19:54Z", "FTYPE": 740, "FCODE": 74026, "NAME": "Keno Rural Fire Protection District Station 1Headquarters", "ISLANDMARK": 2, "POINTLOCATIONTYPE": 1, "ADMINTYPE": 0, "ADDRESSBUILDINGNAME": null, "ADDRESS": "14800 Pucket Road", "CITY": "Klamath Falls", "STATE": "OR", "ZIPCODE": "97601", "GNIS_ID": "2576708", "FOOT_ID": null, "COMPLEX_ID": null, "GLOBALID": "{8515AFCB-6F35-4686-8C70-5BC4FC4850C8}" }, "geometry": { "type": "Point", "coordinates": [ -121.92390433199995, 42.133754625000051 ] } },
{ "type": "Feature", "properties": { "OBJECTID": 10170, "PERMANENT_IDENTIFIER": "{E593B5A0-75E9-4077-A40B-7AEB055083CA}", "SOURCE_FEATUREID": "10461936", "SOURCE_DATASETID": "{CC44F99C-6658-4584-B606-926E498D5C82}", "SOURCE_DATADESC": "TNMC VWE DB Build - Vol Update", "SOURCE_ORIGINATOR": "U.S. Geological Survey", "DATA_SECURITY": 5, "DISTRIBUTION_POLICY": "E4", "LOADDATE": "2015-06-26T11:19:54Z", "FTYPE": 740, "FCODE": 74026, "NAME": "Klamath County Fire District 1 Station 2", "ISLANDMARK": 2, "POINTLOCATIONTYPE": 1, "ADMINTYPE": 0, "ADDRESSBUILDINGNAME": null, "ADDRESS": "7110 Hilyard Avenue", "CITY": "Klamath Falls", "STATE": "OR", "ZIPCODE": "97603", "GNIS_ID": "2576965", "FOOT_ID": null, "COMPLEX_ID": null, "GLOBALID": "{15128AB8-98C3-4774-9059-B9DB8F033E96}" }, "geometry": { "type": "Point", "coordinates": [ -121.702454195999962, 42.19992955400005 ] } },
{ "type": "Feature", "properties": { "OBJECTID": 10194, "PERMANENT_IDENTIFIER": "{2D42534D-ADBA-48C5-843B-714248BACFF1}", "SOURCE_FEATUREID": "10462038", "SOURCE_DATASETID": "{CC44F99C-6658-4584-B606-926E498D5C82}", "SOURCE_DATADESC": "TNMC VWE DB Build - Vol Update", "SOURCE_ORIGINATOR": "U.S. Geological Survey", "DATA_SECURITY": 5, "DISTRIBUTION_POLICY": "E4", "LOADDATE": "2015-06-26T11:19:54Z", "FTYPE": 740, "FCODE": 74026, "NAME": "Upper Chetco Rural Fire Protection District", "ISLANDMARK": 2, "POINTLOCATIONTYPE": 1, "ADMINTYPE": 0, "ADDRESSBUILDINGNAME": null, "ADDRESS": "17548 Gardner Ridge Road", "CITY": "Brookings", "STATE": "OR", "ZIPCODE": "97415", "GNIS_ID": "2576664", "FOOT_ID": null, "COMPLEX_ID": null, "GLOBALID": "{789028C4-8E61-48A0-8017-75F8C753A3E3}" }, "geometry": { "type": "Point", "coordinates": [ -124.204903167999987, 42.086604072000057 ] } },
{ "type": "Feature", "properties": { "OBJECTID": 10221, "PERMANENT_IDENTIFIER": "{0F0256F4-2716-4A97-84C4-6B996C2FF6C7}", "SOURCE_FEATUREID": "10479824", "SOURCE_DATASETID": "{CC44F99C-6658-4584-B606-926E498D5C82}", "SOURCE_DATADESC": "TNMC VWE DB Build - Vol Update", "SOURCE_ORIGINATOR": "U.S. Geological Survey", "DATA_SECURITY": 5, "DISTRIBUTION_POLICY": "E4", "LOADDATE": "2015-06-26T11:19:54Z", "FTYPE": 740, "FCODE": 74026, "NAME": "Keno Rural Fire Protection District Station 2", "ISLANDMARK": 2, "POINTLOCATIONTYPE": 1, "ADMINTYPE": 0, "ADDRESSBUILDINGNAME": null, "ADDRESS": "19900 US Highway 97", "CITY": "Klamath Falls", "STATE": "OR", "ZIPCODE": "97603", "GNIS_ID": "2576675", "FOOT_ID": null, "COMPLEX_ID": null, "GLOBALID": "{09624BB3-4FE4-4B01-8FDE-6704C1494245}" }, "geometry": { "type": "Point", "coordinates": [ -121.867399120999949, 42.045380154000043 ] } },
{ "type": "Feature", "properties": { "OBJECTID": 10265, "PERMANENT_IDENTIFIER": "7195053a-6beb-4566-9db3-6f3fd7c0baf0", "SOURCE_FEATUREID": "10470399", "SOURCE_DATASETID": "{CC44F99C-6658-4584-B606-926E498D5C82}", "SOURCE_DATADESC": "TNMC VWE DB Build - Vol Update", "SOURCE_ORIGINATOR": "U.S. Geological Survey", "DATA_SECURITY": 5, "DISTRIBUTION_POLICY": "E4", "LOADDATE": "2015-06-26T11:19:54Z", "FTYPE": 740, "FCODE": 74026, "NAME": "Illinois Valley Fire District Station 1", "ISLANDMARK": 2, "POINTLOCATIONTYPE": 1, "ADMINTYPE": 0, "ADDRESSBUILDINGNAME": null, "ADDRESS": "679 Caves Highway", "CITY": "Cave Junction", "STATE": "OR", "ZIPCODE": "97523", "GNIS_ID": "2576631", "FOOT_ID": " ", "COMPLEX_ID": null, "GLOBALID": "{74BE5BBB-9737-44C3-BC61-76E21E2A34F2}" }, "geometry": { "type": "Point", "coordinates": [ -123.63571985699997, 42.15923218000006 ] } },
{ "type": "Feature", "properties": { "OBJECTID": 10281, "PERMANENT_IDENTIFIER": "{ED2693FE-AFB1-463E-B448-15D0BB306710}", "SOURCE_FEATUREID": "10470547", "SOURCE_DATASETID": "{CC44F99C-6658-4584-B606-926E498D5C82}", "SOURCE_DATADESC": "TNMC VWE DB Build - Vol Update", "SOURCE_ORIGINATOR": "U.S. Geological Survey", "DATA_SECURITY": 5, "DISTRIBUTION_POLICY": "E4", "LOADDATE": "2015-06-26T11:19:54Z", "FTYPE": 740, "FCODE": 74026, "NAME": "Colestin Rural Fire Protection District", "ISLANDMARK": 2, "POINTLOCATIONTYPE": 4, "ADMINTYPE": 0, "ADDRESSBUILDINGNAME": null, "ADDRESS": "1701 Colestine Road", "CITY": "Ashland", "STATE": "OR", "ZIPCODE": "97520", "GNIS_ID": "2577103", "FOOT_ID": null, "COMPLEX_ID": null, "GLOBALID": "{7EE80A6B-40AE-4798-98FE-C77AD4199FEA}" }, "geometry": { "type": "Point", "coordinates": [ -122.651661197999942, 42.053089853000074 ] } },
{ "type": "Feature", "properties": { "OBJECTID": 10503, "PERMANENT_IDENTIFIER": "{EEE4C000-4264-4F4F-AFD8-4903C138B9FA}", "SOURCE_FEATUREID": "10521419", "SOURCE_DATASETID": "813afb04-de15-40d5-8a0d-502fc753304a", "SOURCE_DATADESC": "740 TNMC Update 10/18/2016 03:02:03", "SOURCE_ORIGINATOR": "U.S. Geological Survey", "DATA_SECURITY": 5, "DISTRIBUTION_POLICY": "E4", "LOADDATE": "2016-10-18T03:02:02Z", "FTYPE": 740, "FCODE": 74026, "NAME": "San Bernardino County Fire Department Station 77 Bloomington", "ISLANDMARK": null, "POINTLOCATIONTYPE": 1, "ADMINTYPE": null, "ADDRESSBUILDINGNAME": null, "ADDRESS": "17459 Slover Avenue", "CITY": "Bloomington", "STATE": "CA", "ZIPCODE": "92316", "GNIS_ID": "2665069", "FOOT_ID": null, "COMPLEX_ID": null, "GLOBALID": "{1C73CFA3-3F66-4323-8BA5-9AF37785F380}" }, "geometry": { "type": "Point", "coordinates": [ -117.423187255999949, 34.062679291000052 ] } },
{ "type": "Feature", "properties": { "OBJECTID": 10532, "PERMANENT_IDENTIFIER": "1cf7be19-d905-4ec9-8fc6-3829ef6d8c89", "SOURCE_FEATUREID": "10514455", "SOURCE_DATASETID": "813afb04-de15-40d5-8a0d-502fc753304a", "SOURCE_DATADESC": "740 TNMC Update 10/18/2016 03:02:03", "SOURCE_ORIGINATOR": "U.S. Geological Survey", "DATA_SECURITY": 5, "DISTRIBUTION_POLICY": "E4", "LOADDATE": "2016-10-18T03:03:06Z", "FTYPE": 740, "FCODE": 74026, "NAME": "Riverside County Fire Department Station 19 Highgrove", "ISLANDMARK": 0, "POINTLOCATIONTYPE": 1, "ADMINTYPE": 0, "ADDRESSBUILDINGNAME": null, "ADDRESS": "469 Center Street", "CITY": "Riverside", "STATE": "CA", "ZIPCODE": "92507", "GNIS_ID": "2664530", "FOOT_ID": null, "COMPLEX_ID": null, "GLOBALID": "{F5BC140B-72D0-49CC-B79C-1030BA9E212C}" }, "geometry": { "type": "Point", "coordinates": [ -117.321044920999952, 34.016025543000069 ] } },
{ "type": "Feature", "properties": { "OBJECTID": 10533, "PERMANENT_IDENTIFIER": "{F7FB0DD3-F32F-46D2-9940-A3D4C6B4162D}", "SOURCE_FEATUREID": "10507098", "SOURCE_DATASETID": "813afb04-de15-40d5-8a0d-502fc753304a", "SOURCE_DATADESC": "740 TNMC Update 10/18/2016 03:02:03", "SOURCE_ORIGINATOR": "U.S. Geological Survey", "DATA_SECURITY": 5, "DISTRIBUTION_POLICY": "E4", "LOADDATE": "2016-10-18T03:03:17Z", "FTYPE": 740, "FCODE": 74026, "NAME": "San Bernardino County Fire Department Station 76 Bloomington", "ISLANDMARK": null, "POINTLOCATIONTYPE": 1, "ADMINTYPE": null, "ADDRESSBUILDINGNAME": null, "ADDRESS": "10174 Magnolia Street", "CITY": "Bloomington", "STATE": "CA", "ZIPCODE": "92316", "GNIS_ID": "2665070", "FOOT_ID": null, "COMPLEX_ID": null, "GLOBALID": "{5D0D9C09-6994-4FFA-B293-36A78005DAAD}" }, "geometry": { "type": "Point", "coordinates": [ -117.398017883999955, 34.069290161000026 ] } },
{ "type": "Feature", "properties": { "OBJECTID": 10534, "PERMANENT_IDENTIFIER": "{20C407EB-AAD9-44B0-9736-4D83C1394D1F}", "SOURCE_FEATUREID": "10514448", "SOURCE_DATASETID": "813afb04-de15-40d5-8a0d-502fc753304a", "SOURCE_DATADESC": "740 TNMC Update 10/18/2016 03:02:03", "SOURCE_ORIGINATOR": "U.S. Geological Survey", "DATA_SECURITY": 5, "DISTRIBUTION_POLICY": "E4", "LOADDATE": "2016-10-18T03:04:11Z", "FTYPE": 740, "FCODE": 74026, "NAME": "Riverside County Fire Department Station 18 West Riverside", "ISLANDMARK": null, "POINTLOCATIONTYPE": 1, "ADMINTYPE": null, "ADDRESSBUILDINGNAME": null, "ADDRESS": "7545 Mission Boulevard", "CITY": "Riverside", "STATE": "CA", "ZIPCODE": "92509", "GNIS_ID": "2664984", "FOOT_ID": null, "COMPLEX_ID": null, "GLOBALID": "{D9777429-247B-4226-AFD9-9B1D21EC5A56}" }, "geometry": { "type": "Point", "coordinates": [ -117.448272704999965, 34.012447357000042 ] } },
{ "type": "Feature", "properties": { "OBJECTID": 10535, "PERMANENT_IDENTIFIER": "{66D7E380-68EA-4101-9B5E-68C220A4D99A}", "SOURCE_FEATUREID": "10167485", "SOURCE_DATASETID": "813afb04-de15-40d5-8a0d-502fc753304a", "SOURCE_DATADESC": "740 TNMC Update 10/18/2016 03:02:03", "SOURCE_ORIGINATOR": "U.S. Geological Survey", "DATA_SECURITY": 5, "DISTRIBUTION_POLICY": "E4", "LOADDATE": "2016-10-18T03:04:21Z", "FTYPE": 740, "FCODE": 74026, "NAME": "Norco Fire Department Station 22", "ISLANDMARK": null, "POINTLOCATIONTYPE": 1, "ADMINTYPE": null, "ADDRESSBUILDINGNAME": null, "ADDRESS": "3902 Hillside Avenue", "CITY": "Norco", "STATE": "CA", "ZIPCODE": "92860", "GNIS_ID": "2665318", "FOOT_ID": null, "COMPLEX_ID": null, "GLOBALID": "{9105A0E7-25C4-491D-8CA3-5B8A386F481F}" }, "geometry": { "type": "Point", "coordinates": [ -117.537483215999941, 33.938732147000053 ] } },
{ "type": "Feature", "properties": { "OBJECTID": 10537, "PERMANENT_IDENTIFIER": "{D16C1334-17B3-49F3-BFE2-5BD5E935DAF8}", "SOURCE_FEATUREID": "10511875", "SOURCE_DATASETID": "813afb04-de15-40d5-8a0d-502fc753304a", "SOURCE_DATADESC": "740 TNMC Update 10/18/2016 03:02:03", "SOURCE_ORIGINATOR": "U.S. Geological Survey", "DATA_SECURITY": 5, "DISTRIBUTION_POLICY": "E4", "LOADDATE": "2016-10-18T03:05:10Z", "FTYPE": 740, "FCODE": 74026, "NAME": "Riverside County Fire Department Station 15 El Cerrito", "ISLANDMARK": null, "POINTLOCATIONTYPE": 1, "ADMINTYPE": null, "ADDRESSBUILDINGNAME": null, "ADDRESS": "20320 Temescal Canyon Road", "CITY": "Corona", "STATE": "CA", "ZIPCODE": "92881", "GNIS_ID": "2664926", "FOOT_ID": null, "COMPLEX_ID": null, "GLOBALID": "{B8F3EEAD-5DC6-497E-BB9A-B8072B56A735}" }, "geometry": { "type": "Point", "coordinates": [ -117.510902404999968, 33.825378418000071 ] } },
{ "type": "Feature", "properties": { "OBJECTID": 10538, "PERMANENT_IDENTIFIER": "{91CCCDCD-04E0-4A36-BDC0-70BA51DFCA8A}", "SOURCE_FEATUREID": "10139723", "SOURCE_DATASETID": "813afb04-de15-40d5-8a0d-502fc753304a", "SOURCE_DATADESC": "740 TNMC Update 10/18/2016 03:02:03", "SOURCE_ORIGINATOR": "U.S. Geological Survey", "DATA_SECURITY": 5, "DISTRIBUTION_POLICY": "E4", "LOADDATE": "2016-10-18T03:05:39Z", "FTYPE": 740, "FCODE": 74026, "NAME": "Riverside County Fire Department Station 90 North Perris", "ISLANDMARK": null, "POINTLOCATIONTYPE": 1, "ADMINTYPE": null, "ADDRESSBUILDINGNAME": null, "ADDRESS": "333 Placentia Avenue", "CITY": "Perris", "STATE": "CA", "ZIPCODE": "92571", "GNIS_ID": "2665253", "FOOT_ID": null, "COMPLEX_ID": null, "GLOBALID": "{34342BD1-988A-4049-B9D6-8A0EC5615D4D}" }, "geometry": { "type": "Point", "coordinates": [ -117.218940735, 33.822505951000039 ] } },
{ "type": "Feature", "properties": { "OBJECTID": 10572, "PERMANENT_IDENTIFIER": "{C44AE42D-3512-4915-9392-617DAA15C2CA}", "SOURCE_FEATUREID": "10139173", "SOURCE_DATASETID": "813afb04-de15-40d5-8a0d-502fc753304a", "SOURCE_DATADESC": "740 TNMC Update 10/18/2016 03:02:03", "SOURCE_ORIGINATOR": "U.S. Geological Survey", "DATA_SECURITY": 5, "DISTRIBUTION_POLICY": "E4", "LOADDATE": "2016-10-18T03:06:20Z", "FTYPE": 740, "FCODE": 74026, "NAME": "Hemet Fire Department Station 5", "ISLANDMARK": null, "POINTLOCATIONTYPE": 1, "ADMINTYPE": null, "ADDRESSBUILDINGNAME": null, "ADDRESS": "120 North Hemet Street", "CITY": "Hemet", "STATE": "CA", "ZIPCODE": "92544", "GNIS_ID": "2665363", "FOOT_ID": null, "COMPLEX_ID": null, "GLOBALID": "{B1F5F97D-1E6F-41B5-846B-1B0FCAC69901}" }, "geometry": { "type": "Point", "coordinates": [ -116.922988890999989, 33.748588562000066 ] } },
{ "type": "Feature", "properties": { "OBJECTID": 10573, "PERMANENT_IDENTIFIER": "{D6C62019-FB79-4AED-875F-99039E414DDA}", "SOURCE_FEATUREID": "10521243", "SOURCE_DATASETID": "813afb04-de15-40d5-8a0d-502fc753304a", "SOURCE_DATADESC": "740 TNMC Update 10/18/2016 03:02:03", "SOURCE_ORIGINATOR": "U.S. Geological Survey", "DATA_SECURITY": 5, "DISTRIBUTION_POLICY": "E4", "LOADDATE": "2016-10-18T03:06:35Z", "FTYPE": 740, "FCODE": 74026, "NAME": "Riverside County Fire Department Station 96 Glen Oaks", "ISLANDMARK": null, "POINTLOCATIONTYPE": 1, "ADMINTYPE": null, "ADDRESSBUILDINGNAME": null, "ADDRESS": "37700 Glen Oaks Road", "CITY": "Temecula", "STATE": "CA", "ZIPCODE": "92592", "GNIS_ID": "2664925", "FOOT_ID": null, "COMPLEX_ID": null, "GLOBALID": "{60B4124F-6816-40D1-B479-C00F4276B28E}" }, "geometry": { "type": "Point", "coordinates": [ -117.000083922999977, 33.556564331000061 ] } },
{ "type": "Feature", "properties": { "OBJECTID": 10574, "PERMANENT_IDENTIFIER": "{F8049359-259D-41FE-A39E-FBC86E8B718C}", "SOURCE_FEATUREID": "10519899", "SOURCE_DATASETID": "813afb04-de15-40d5-8a0d-502fc753304a", "SOURCE_DATADESC": "740 TNMC Update 10/18/2016 03:02:03", "SOURCE_ORIGINATOR": "U.S. Geological Survey", "DATA_SECURITY": 5, "DISTRIBUTION_POLICY": "E4", "LOADDATE": "2016-10-18T03:06:42Z", "FTYPE": 740, "FCODE": 74026, "NAME": "Riverside County Fire Department Station 52 Cottonwood", "ISLANDMARK": null, "POINTLOCATIONTYPE": 1, "ADMINTYPE": null, "ADDRESSBUILDINGNAME": null, "ADDRESS": "44222 Sage Road", "CITY": "Aguanga", "STATE": "CA", "ZIPCODE": "92536", "GNIS_ID": "2664942", "FOOT_ID": null, "COMPLEX_ID": null, "GLOBALID": "{25403133-EF55-449F-9631-29B87C385D51}" }, "geometry": { "type": "Point", "coordinates": [ -116.91144561699997, 33.48173141500007 ] } },
{ "type": "Feature", "properties": { "OBJECTID": 10601, "PERMANENT_IDENTIFIER": "5209451f-ad44-4fa1-9b87-e0d1ed817600", "SOURCE_FEATUREID": "10508433", "SOURCE_DATASETID": "171c18e2-1deb-4ab3-adb8-0375bfb08671", "SOURCE_DATADESC": "740 TNMC Update 11/10/2016 16:03:36", "SOURCE_ORIGINATOR": "U.S. Geological Survey", "DATA_SECURITY": 5, "DISTRIBUTION_POLICY": "E4", "LOADDATE": "2016-11-10T16:58:31Z", "FTYPE": 740, "FCODE": 74026, "NAME": "West Almanor Community Services District Fire Station", "ISLANDMARK": 0, "POINTLOCATIONTYPE": 4, "ADMINTYPE": 0, "ADDRESSBUILDINGNAME": null, "ADDRESS": "947 Long Iron Drive", "CITY": "Chester", "STATE": "CA", "ZIPCODE": "96020", "GNIS_ID": "2621873", "FOOT_ID": " ", "COMPLEX_ID": null, "GLOBALID": "{10177647-DB93-42FF-B21C-E2A0123A9441}" }, "geometry": { "type": "Point", "coordinates": [ -121.204483031999985, 40.237709045000031 ] } },
{ "type": "Feature", "properties": { "OBJECTID": 10602, "PERMANENT_IDENTIFIER": "66cfbb9e-1e7a-458b-9cb3-71b06a71a71e", "SOURCE_FEATUREID": "10508166", "SOURCE_DATASETID": "171c18e2-1deb-4ab3-adb8-0375bfb08671", "SOURCE_DATADESC": "740 TNMC Update 11/10/2016 16:03:36", "SOURCE_ORIGINATOR": "U.S. Geological Survey", "DATA_SECURITY": 5, "DISTRIBUTION_POLICY": "E4", "LOADDATE": "2016-11-10T17:05:41Z", "FTYPE": 740, "FCODE": 74026, "NAME": "Peninsula Fire Protection District Station 2", "ISLANDMARK": 0, "POINTLOCATIONTYPE": 1, "ADMINTYPE": 0, "ADDRESSBUILDINGNAME": null, "ADDRESS": "801 Golf Club Road", "CITY": "Westwood", "STATE": "CA", "ZIPCODE": "96137", "GNIS_ID": "2621866", "FOOT_ID": " ", "COMPLEX_ID": null, "GLOBALID": "{F5BAB79A-9E74-4FC1-AD40-795745F23908}" }, "geometry": { "type": "Point", "coordinates": [ -121.145263670999952, 40.247604370000033 ] } },
{ "type": "Feature", "properties": { "OBJECTID": 10619, "PERMANENT_IDENTIFIER": "acd8ecff-207e-4196-99f5-a3f9fd7c4c41", "SOURCE_FEATUREID": "10508192", "SOURCE_DATASETID": "171c18e2-1deb-4ab3-adb8-0375bfb08671", "SOURCE_DATADESC": "740 TNMC Update 11/10/2016 16:03:36", "SOURCE_ORIGINATOR": "U.S. Geological Survey", "DATA_SECURITY": 5, "DISTRIBUTION_POLICY": "E4", "LOADDATE": "2016-11-10T17:13:24Z", "FTYPE": 740, "FCODE": 74026, "NAME": "Quincy Fire Protection District Station 1 Headquarters", "ISLANDMARK": 0, "POINTLOCATIONTYPE": 1, "ADMINTYPE": 0, "ADDRESSBUILDINGNAME": null, "ADDRESS": "505 Lawrence Street", "CITY": "Quincy", "STATE": "CA", "ZIPCODE": "95971", "GNIS_ID": "2621830", "FOOT_ID": " ", "COMPLEX_ID": null, "GLOBALID": "{D91BC50F-57E5-4CF8-B07B-7A330BD3A1C5}" }, "geometry": { "type": "Point", "coordinates": [ -120.947921752999946, 39.93780517600004 ] } },
{ "type": "Feature", "properties": { "OBJECTID": 10621, "PERMANENT_IDENTIFIER": "11ed1e36-011b-4439-92d6-869886ef49b0", "SOURCE_FEATUREID": "10142166", "SOURCE_DATASETID": "171c18e2-1deb-4ab3-adb8-0375bfb08671", "SOURCE_DATADESC": "740 TNMC Update 11/10/2016 16:03:36", "SOURCE_ORIGINATOR": "U.S. Geological Survey", "DATA_SECURITY": 5, "DISTRIBUTION_POLICY": "E4", "LOADDATE": "2016-11-10T17:21:09Z", "FTYPE": 740, "FCODE": 74026, "NAME": "Susanville Fire Department", "ISLANDMARK": 0, "POINTLOCATIONTYPE": 1, "ADMINTYPE": 0, "ADDRESSBUILDINGNAME": null, "ADDRESS": "1505 Main Street", "CITY": "Susanville", "STATE": "CA", "ZIPCODE": "96130", "GNIS_ID": "2621785", "FOOT_ID": " ", "COMPLEX_ID": null, "GLOBALID": "{3957E5A5-D6A7-4F8B-92A2-B7F699BD8192}" }, "geometry": { "type": "Point", "coordinates": [ -120.651817321999943, 40.416500092000035 ] } },
{ "type": "Feature", "properties": { "OBJECTID": 10735, "PERMANENT_IDENTIFIER": "{08A89FC7-5582-491F-8A4A-80FF63BCC37D}", "SOURCE_FEATUREID": "10511176", "SOURCE_DATASETID": "81774a07-e015-46d4-b49c-b86a3161bc41", "SOURCE_DATADESC": "740 TNMC Update 10/09/2016 18:32:00", "SOURCE_ORIGINATOR": "U.S. Geological Survey", "DATA_SECURITY": 5, "DISTRIBUTION_POLICY": "E4", "LOADDATE": "2016-10-09T18:35:16Z", "FTYPE": 740, "FCODE": 74026, "NAME": "San Francisco Fire Department Station 7", "ISLANDMARK": 2, "POINTLOCATIONTYPE": 1, "ADMINTYPE": null, "ADDRESSBUILDINGNAME": null, "ADDRESS": "2300 Folsom Street", "CITY": "San Francisco", "STATE": "CA", "ZIPCODE": "94110", "GNIS_ID": "2107347", "FOOT_ID": null, "COMPLEX_ID": null, "GLOBALID": "{2FDC12B1-CBEA-4A10-BEBC-3BD73734708C}" }, "geometry": { "type": "Point", "coordinates": [ -122.415115355999944, 37.760284424000076 ] } },
{ "type": "Feature", "properties": { "OBJECTID": 10751, "PERMANENT_IDENTIFIER": "{DD86923D-52B8-4777-AD50-1A16A18596BF}", "SOURCE_FEATUREID": "10511172", "SOURCE_DATASETID": "09a06466-3fd7-4bdf-98a0-7c64611fa569", "SOURCE_DATADESC": "780 TNMC Update 10/09/2016 22:16:15", "SOURCE_ORIGINATOR": "U.S. Geological Survey", "DATA_SECURITY": 5, "DISTRIBUTION_POLICY": "E4", "LOADDATE": "2016-10-09T22:19:32Z", "FTYPE": 740, "FCODE": 74026, "NAME": "San Francisco Fire Department Station 2", "ISLANDMARK": 2, "POINTLOCATIONTYPE": 1, "ADMINTYPE": null, "ADDRESSBUILDINGNAME": null, "ADDRESS": "1340 Powell Street", "CITY": "San Francisco", "STATE": "CA", "ZIPCODE": "94133", "GNIS_ID": "1655378", "FOOT_ID": null, "COMPLEX_ID": null, "GLOBALID": "{EE3EBD87-C6C0-4209-9383-686B56F997EA}" }, "geometry": { "type": "Point", "coordinates": [ -122.40991211, 37.797023773000035 ] } },
{ "type": "Feature", "properties": { "OBJECTID": 10774, "PERMANENT_IDENTIFIER": "32dc7c42-b25c-4b92-ad3d-c1df72e72038", "SOURCE_FEATUREID": "10141821", "SOURCE_DATASETID": "785ec292-64ae-4b7d-b7f5-6ea2dd88f10d", "SOURCE_DATADESC": "740 TNMC Update 1/11/2017", "SOURCE_ORIGINATOR": "U.S. Geological Survey", "DATA_SECURITY": 5, "DISTRIBUTION_POLICY": "E4", "LOADDATE": "2017-01-11T20:27:20Z", "FTYPE": 740, "FCODE": 74026, "NAME": "Naval Postgraduate School Fire Station", "ISLANDMARK": 0, "POINTLOCATIONTYPE": 4, "ADMINTYPE": 0, "ADDRESSBUILDINGNAME": null, "ADDRESS": "1399 Cunningham Road", "CITY": "Monterey", "STATE": "CA", "ZIPCODE": "93943", "GNIS_ID": "2623756", "FOOT_ID": " ", "COMPLEX_ID": null, "GLOBALID": "{4D0CF1EF-01CB-42C2-BBCE-4A9BFBA17C04}" }, "geometry": { "type": "Point", "coordinates": [ -121.876800537999941, 36.598384857000042 ] } },
{ "type": "Feature", "properties": { "OBJECTID": 10775, "PERMANENT_IDENTIFIER": "114c7f33-c0d0-4e6e-b05e-cf44f79c66ef", "SOURCE_FEATUREID": "9999999999", "SOURCE_DATASETID": "785ec292-64ae-4b7d-b7f5-6ea2dd88f10d", "SOURCE_DATADESC": "740 TNMC Update 1/11/2017", "SOURCE_ORIGINATOR": "U.S. Geological Survey", "DATA_SECURITY": 5, "DISTRIBUTION_POLICY": "E4", "LOADDATE": "2017-01-11T20:28:01Z", "FTYPE": 740, "FCODE": 74026, "NAME": "Monterey Fire Department Station 1", "ISLANDMARK": 0, "POINTLOCATIONTYPE": 1, "ADMINTYPE": 0, "ADDRESSBUILDINGNAME": null, "ADDRESS": "600 Pacific Street", "CITY": "Monterey", "STATE": "CA", "ZIPCODE": "93940", "GNIS_ID": "2623877", "FOOT_ID": " ", "COMPLEX_ID": null, "GLOBALID": "{FF324AC6-B89E-4A87-B0F7-8C9250017F27}" }, "geometry": { "type": "Point", "coordinates": [ -121.897720336999953, 36.596393585000044 ] } },
{ "type": "Feature", "properties": { "OBJECTID": 10785, "PERMANENT_IDENTIFIER": "{3D8317B4-EA9A-42E6-A12A-09FF806AD1FD}", "SOURCE_FEATUREID": "10511854", "SOURCE_DATASETID": "785ec292-64ae-4b7d-b7f5-6ea2dd88f10d", "SOURCE_DATADESC": "740 TNMC Update 1/11/2017", "SOURCE_ORIGINATOR": "U.S. Geological Survey", "DATA_SECURITY": 5, "DISTRIBUTION_POLICY": "E4", "LOADDATE": "2017-01-11T20:28:44Z", "FTYPE": 740, "FCODE": 74026, "NAME": "Department of Forestry and Fire Station Carmel Hill Unit", "ISLANDMARK": 2, "POINTLOCATIONTYPE": 1, "ADMINTYPE": null, "ADDRESSBUILDINGNAME": null, "ADDRESS": "4180 Seventeen Mile Drive", "CITY": "Pebble Beach", "STATE": "CA", "ZIPCODE": "93953", "GNIS_ID": "2623922", "FOOT_ID": null, "COMPLEX_ID": null, "GLOBALID": "{A77E26E8-20C4-454E-9672-13DE6A86AAF8}" }, "geometry": { "type": "Point", "coordinates": [ -121.913986205999947, 36.574119568000071 ] } },
{ "type": "Feature", "properties": { "OBJECTID": 10786, "PERMANENT_IDENTIFIER": "a930f357-9006-4c70-91ab-38a654516004", "SOURCE_FEATUREID": "10511931", "SOURCE_DATASETID": "e3dd0c31-f8fb-45e0-a507-e37187e4b9f3", "SOURCE_DATADESC": "740 TNMC Update 2/2/2017", "SOURCE_ORIGINATOR": "U.S. Geological Survey", "DATA_SECURITY": 5, "DISTRIBUTION_POLICY": "E4", "LOADDATE": "2017-02-02T21:24:20Z", "FTYPE": 740, "FCODE": 74026, "NAME": "Bakersfield Fire Department Station 3", "ISLANDMARK": 0, "POINTLOCATIONTYPE": 1, "ADMINTYPE": 0, "ADDRESSBUILDINGNAME": null, "ADDRESS": "3400 Palm Street", "CITY": "Bakersfield", "STATE": "CA", "ZIPCODE": "93309", "GNIS_ID": "1839217", "FOOT_ID": " ", "COMPLEX_ID": null, "GLOBALID": "{65FC2944-8A1B-4FD0-A978-7E94C12B6CFC}" }, "geometry": { "type": "Point", "coordinates": [ -119.04175567599998, 35.361686706000057 ] } },
{ "type": "Feature", "properties": { "OBJECTID": 10796, "PERMANENT_IDENTIFIER": "c7d8782f-aafa-4df8-bbd2-5baa3db61613", "SOURCE_FEATUREID": "10511755", "SOURCE_DATASETID": "e3dd0c31-f8fb-45e0-a507-e37187e4b9f3", "SOURCE_DATADESC": "740 TNMC Update 2/2/2017", "SOURCE_ORIGINATOR": "U.S. Geological Survey", "DATA_SECURITY": 5, "DISTRIBUTION_POLICY": "E4", "LOADDATE": "2017-02-02T21:30:44Z", "FTYPE": 740, "FCODE": 74026, "NAME": "Bakersfield Fire Department Station 13", "ISLANDMARK": 0, "POINTLOCATIONTYPE": 1, "ADMINTYPE": 0, "ADDRESSBUILDINGNAME": null, "ADDRESS": "4900 Poppyseed Street", "CITY": "Bakersfield", "STATE": "CA", "ZIPCODE": "93313", "GNIS_ID": "2664551", "FOOT_ID": " ", "COMPLEX_ID": null, "GLOBALID": "{EDCDA2B1-ADEA-47E7-A81D-C6042C7A2FBB}" }, "geometry": { "type": "Point", "coordinates": [ -119.057006835999971, 35.291416168000069 ] } },
{ "type": "Feature", "properties": { "OBJECTID": 10813, "PERMANENT_IDENTIFIER": "{937C1064-5023-47D8-A7F8-2D87012A38D3}", "SOURCE_FEATUREID": "10508178", "SOURCE_DATASETID": "bdbf8f9d-cc31-491a-8616-120dacfd16ff", "SOURCE_DATADESC": "740 TNMC Update 12/27/2016", "SOURCE_ORIGINATOR": "U.S. Geological Survey", "DATA_SECURITY": 5, "DISTRIBUTION_POLICY": "E4", "LOADDATE": "2016-12-27T23:04:45Z", "FTYPE": 740, "FCODE": 74026, "NAME": "Pleasant Grove Fire Department", "ISLANDMARK": 2, "POINTLOCATIONTYPE": 1, "ADMINTYPE": 0, "ADDRESSBUILDINGNAME": null, "ADDRESS": "3100 Howsley Road", "CITY": "Pleasant Grove", "STATE": "CA", "ZIPCODE": "95668", "GNIS_ID": "2622050", "FOOT_ID": null, "COMPLEX_ID": null, "GLOBALID": "{51C84FF0-8E4A-4A65-BCAD-6696C12E484D}" }, "geometry": { "type": "Point", "coordinates": [ -121.503379820999953, 38.824218750000057 ] } },
{ "type": "Feature", "properties": { "OBJECTID": 10896, "PERMANENT_IDENTIFIER": "{82EEF210-9323-4170-B234-FE477752493B}", "SOURCE_FEATUREID": "10522325", "SOURCE_DATASETID": "2e0943ca-1c6b-4b66-99c3-9d82a41551f2", "SOURCE_DATADESC": "740 TNMC Update 3/3/2017", "SOURCE_ORIGINATOR": "U.S. Geological Survey", "DATA_SECURITY": 5, "DISTRIBUTION_POLICY": "E4", "LOADDATE": "2017-03-03T22:52:52Z", "FTYPE": 740, "FCODE": 74026, "NAME": "Ventura County Fire Protection District Station 22 Meiners Oaks", "ISLANDMARK": null, "POINTLOCATIONTYPE": 1, "ADMINTYPE": null, "ADDRESSBUILDINGNAME": null, "ADDRESS": "466 South La Luna Avenue", "CITY": "Ojai", "STATE": "CA", "ZIPCODE": "93023", "GNIS_ID": "2665281", "FOOT_ID": null, "COMPLEX_ID": null, "GLOBALID": "{103778A8-3397-4C53-8A60-72B498902FAC}" }, "geometry": { "type": "Point", "coordinates": [ -119.285430907999967, 34.444427490000066 ] } },
